"","subreddit","score","ngram","occurrences"
"545","crazyideas",36.08,"thanks for the gold",13
"546","crazyideas",35.33,"the fuck did you",12
"547","crazyideas",34.94,"while we're at it",18
"548","crazyideas",34.08,"that's the kind of",12
"549","crazyideas",33,"is why we can't",11
"550","crazyideas",32.25,"it would need to",12
"551","creepy",44.55,"thanks for the gold",11
"552","creepy",30.41,"in front of a",17
"553","creepy",30.23,"you can clearly see",13
"554","creepy",28.91,"but i don't have",11
"555","creepy",27.69,"the middle of nowhere",26
"556","creepy",27.18,"to be that guy",11
"557","creepy",26.73,"on the outside of",11
"558","creepy",26.45,"one of them is",11
"559","creepy",26.4,"is the first thing",15
"560","creepy",26.36,"the worst part is",11
"561","creepypms",57.55,"just let me in",11
"562","creepypms",53.64,"thanks for all the",11
"563","creepypms",52.85,"is some kind of",13
"564","creepypms",51.67,"to be a girl",18
"565","creepypms",51.21,"the fact that she",14
"566","creepypms",50.69,"you didn't want to",13
"567","creepypms",49.45,"i'm willing to bet",11
"568","creepypms",49.14,"to the police station",14
"569","creepypms",48.27,"make me want to",11
"570","creepypms",47.17,"it seems like he",18
"571","cringe",75.58,"why on earth would",12
"572","cringe",71.57,"thanks for the gold",14
"573","cringe",65.92,"gnyah gnyah gnyah gnyah",13
"574","cringe",65.14,"the look on her",14
"575","cringe",64,"it is but it",11
"576","cringe",61.91,"it be like it",11
"577","cringe",61.91,"think it be like",11
"578","cringe",59.72,"look on her face",18
"579","cringe",56.09,"up on stage and",11
"580","cringe",55.82,"edit: thanks for the",11
"581","cringepics",78.45,"in case anyone is",11
"582","cringepics",73.27,"me but just another",11
"583","cringepics",71.82,"that wipes out the",11
"584","cringepics",71.18,"and i have over",11
"585","cringepics",70.75,"to me but just",12
"586","cringepics",70.27,"are nothing to me",11
"587","cringepics",70.27,"nothing to me but",11
"588","cringepics",70.27,"you are nothing to",11
"589","cringepics",70.15,"been involved in numerous",13
"590","cringepics",70.15,"of which has never",13
"591","dadjokes",44.67,"going to make a",15
"592","dadjokes",44.04,"a great dad someday",23
"593","dadjokes",40.69,"over and over again",13
"594","dadjokes",36.8,"this to my dad",15
"595","dadjokes",36.03,"make a great dad",36
"596","dadjokes",35.45,"be a great dad",22
"597","dadjokes",35.42,"what's the difference between",12
"598","dadjokes",34.76,"the difference between a",17
"599","dadjokes",34.27,"this isn't a dad",11
"600","dadjokes",33.59,"the best dad jokes",17
"601","dataisbeautiful",56.64,"thanks for the gold",14
"602","dataisbeautiful",41.07,"was meant to be",14
"603","dataisbeautiful",40.58,"a 20 year old",12
"604","dataisbeautiful",40.27,"and i was like",11
"605","dataisbeautiful",39.73,"is seen as a",11
"606","dataisbeautiful",38.93,"the number of women",14
"607","dataisbeautiful",38.82,"all you have to",11
"608","dataisbeautiful",38.67,"please feel free to",12
"609","dataisbeautiful",38.25,"me a while to",16
"610","dataisbeautiful",37.64,"they just want to",11
"611","dayz",33.33,"a group of players",12
"612","dayz",28.73,"they should be able",11
"613","dayz",27.58,"as soon as we",12
"614","dayz",27,"a good example of",13
"615","dayz",26.77,"taste in my mouth",13
"616","dayz",26.68,"this is actually a",19
"617","dayz",26.36,"""i have a funny",11
"618","dayz",26.17,"i think its a",12
"619","dayz",25.55,"the dev team for",11
"620","dayz",25.36,"have a funny taste",22
"621","depthhub",23.59,"this is a pretty",17
"622","depthhub",22.5,"all of the other",12
"623","depthhub",22,"it was meant to",12
"624","depthhub",22,"with the concept of",12
"625","depthhub",21.64,"to be much more",11
"626","depthhub",21.26,"to a point where",19
"627","depthhub",21.17,"isn't to say that",12
"628","depthhub",21,"how easy it is",11
"629","depthhub",21,"it is entirely possible",12
"630","depthhub",20.93,"is a much more",15
"631","design",37.18,"you as a designer",11
"632","design",23.07,"look like they were",14
"633","design",23.06,"use of negative space",18
"634","design",23,"on a business card",11
"635","design",22,"to do with a",13
"636","design",21.58,"the sort of thing",12
"637","design",21.17,"the form of a",12
"638","design",20.09,"too much of a",11
"639","design",19.33,"but i have a",15
"640","design",18.55,"so you can see",11
"641","destinythegame",52.31,"edit: thanks for the",13
"642","destinythegame",46.58,"a better story than",12
"643","destinythegame",44.36,"want to know more",11
"644","destinythegame",44.08,"i can't stop playing",12
"645","destinythegame",43,"true meaning of christmas",19
"646","destinythegame",41.89,"no place for mercy",18
"647","destinythegame",38.36,"the game i was",11
"648","destinythegame",36.45,"walls of our city",11
"649","destinythegame",34.08,"want destiny to be",13
"650","destinythegame",32.58,"the tower and the",12
"651","diablo",49,"proc coefficient reduced from",12
"652","diablo",43.5,"a bug that was",12
"653","diablo",43.5,"bug that was causing",12
"654","diablo",41.96,"those of you at",23
"655","diablo",41.77,"find and gold find",13
"656","diablo",41.77,"magic find and gold",13
"657","diablo",41.43,"didn't care for it",14
"658","diablo",41.36,"for it too much",11
"659","diablo",40.87,"fixed a bug where",23
"660","diablo",40.35,"do you see that",20
"661","diy",53.73,"thanks for the gold",11
"662","diy",41.23,"saved a ton of",13
"663","diy",38.09,"had to go to",11
"664","diy",37.58,"shut the fuck up",12
"665","diy",36.64,"grew up with a",11
"666","diy",35.92,"what was the final",13
"667","diy",35.79,"but you get the",14
"668","diy",35.42,"happy to answer any",12
"669","diy",34.67,"for over a year",12
"670","diy",34.44,"lot of people are",16
"671","doctorwho",39.82,"of planets have a",11
"672","doctorwho",38.92,"noble has been saved",13
"673","doctorwho",37.69,"donna noble has left",13
"674","doctorwho",36.91,"you know what so",23
"675","doctorwho",36.41,"and you know what",22
"676","doctorwho",36.08,"role of the doctor",12
"677","doctorwho",35.91,"library donna noble has",11
"678","doctorwho",35.18,"about the time war",11
"679","doctorwho",34.94,"donna noble has been",16
"680","doctorwho",34.23,"as a straight male",13
"681","documentaries",28.74,"the smartest guys in",19
"682","documentaries",27.55,"machines of loving grace",11
"683","documentaries",26,"guys in the room",19
"684","documentaries",25.92,"all watched over by",12
"685","documentaries",25.59,"smartest guys in the",22
"686","documentaries",25,"there is not a",11
"687","documentaries",24.55,"for more than a",11
"688","documentaries",24.31,"i don't think i've",13
"689","documentaries",23.71,"a documentary about a",17
"690","documentaries",23.67,"the rise of the",12
"691","doesanybodyelse",34.08,"in my high school",13
"692","doesanybodyelse",29.85,"pisses me off when",13
"693","doesanybodyelse",29.67,"you want it to",12
"694","doesanybodyelse",29.62,"no one is going",13
"695","doesanybodyelse",29.62,"one is going to",13
"696","doesanybodyelse",28.73,"in the world to",11
"697","doesanybodyelse",27.92,"they are doing it",12
"698","doesanybodyelse",27.64,"no one seems to",11
"699","doesanybodyelse",27.58,"takes a lot of",12
"700","doesanybodyelse",26.82,"wanted to be a",11
"701","dota2",69.27,"has a bounce limit",11
"702","dota2",69.27,"longer has a bounce",11
"703","dota2",66.79,"no longer has a",14
"704","dota2",64.5,"\u0f3c \u3064 \u25d5\u203f\u25d5 \u0f3d\u3064",12
"705","dota2",57.07,"and why is it",15
"706","dota2",51.74,"thanks for the gold",19
"707","dota2",46.92,"one has ever done",12
"708","dota2",44.91,"to the grand finals",11
"709","dota2",44.77,"is this real life",13
"710","dota2",44.54,"oh my god that",13
"711","drugs",41.55,"collection the tendency is",11
"712","drugs",41.55,"drug collection the tendency",11
"713","drugs",41.55,"get locked into a",11
"714","drugs",41.55,"locked into a serious",11
"715","drugs",41.55,"once you get locked",11
"716","drugs",41.55,"serious drug collection the",11
"717","drugs",41.55,"you get locked into",11
"718","drugs",40.5,"a serious drug collection",12
"719","drugs",38.25,"the tendency is to",12
"720","drugs",38.25,"to push it as",12
"721","drunk",26.33,"can get these in",15
"722","drunk",25.33,"me of the time",15
"723","drunk",24.5,"you can get these",16
"724","drunk",24.17,"me you can get",12
"725","drunk",24.17,"tell me you can",12
"726","drunk",24,"if you have to",12
"727","drunk",21.91,"when i saw this",11
"728","drunk",19.07,"to the bar and",14
"729","drunk",18.46,"at first i thought",13
"730","drunk",18.06,"in front of the",16
"731","earthporn",31.08,"in the valley of",12
"732","earthporn",29.55,"this was taken in",11
"733","earthporn",27.64,"number one exporter of",11
"734","earthporn",27.33,"out when there's heat",12
"735","earthporn",26.27,"hell of a place",11
"736","earthporn",25.69,"there's heat all about",13
"737","earthporn",25.69,"when there's heat all",13
"738","earthporn",24.73,"tough black mineral that",11
"739","earthporn",24.69,"so you can see",13
"740","earthporn",23.73,"deepest lake in the",11
"741","eatcheapandhealthy",32.14,"formatted for easier viewing",14
"742","eatcheapandhealthy",28,"high in vitamin c",13
"743","eatcheapandhealthy",27.73,"2 cloves garlic minced",11
"744","eatcheapandhealthy",26.35,"for lunch the next",17
"745","eatcheapandhealthy",24.38,"trans fat 00g cholesterol",16
"746","eatcheapandhealthy",24.15,"reduce heat to low",13
"747","eatcheapandhealthy",23.18,"beans and rice are",11
"748","eatcheapandhealthy",22.5,"just wanted to say",12
"749","eatcheapandhealthy",21.27,"you can get some",11
"750","eatcheapandhealthy",21.2,"lunch the next day",25
"751","economics",31,"don't want to hire",11
"752","economics",29,"not sure how this",11
"753","economics",28.64,"as the united states",11
"754","economics",28.09,"if that is what",11
"755","economics",26.55,"good for the consumer",11
"756","economics",26,"a net exporter of",13
"757","economics",25.92,"go to the hospital",12
"758","economics",25.83,"many of the other",12
"759","economics",25.33,"that those who are",12
"760","economics",24.75,"to be involved in",16
"761","electronicmusic",35.55,"aphex twin - selected",11
"762","electronicmusic",33.73,"for the love of",11
"763","electronicmusic",33.25,"- selected ambient works",12
"764","electronicmusic",33.25,"twin - selected ambient",12
"765","electronicmusic",30.45,"of canada - music",20
"766","electronicmusic",29.71,"- music has the",17
"767","electronicmusic",27.61,"canada - music has",18
"768","electronicmusic",27.15,"sound of london -",13
"769","electronicmusic",27.08,"massive attack - mezzanine",12
"770","electronicmusic",27.08,"new daft punk album",13
"771","entertainment",33.86,"i can't be the",14
"772","entertainment",33.13,"the guy on the",15
"773","entertainment",31.92,"need to go to",12
"774","entertainment",30.67,"i don't see a",12
"775","entertainment",29,"the host of the",11
"776","entertainment",27.36,"i didn't get the",11
"777","entertainment",26.58,"was making fun of",12
"778","entertainment",26,"nothing of value was",12
"779","entertainment",26,"of value was lost",12
"780","entertainment",25.85,"they were on the",13
"781","entrepreneur",20.53,"to sign an nda",17
"782","entrepreneur",20.29,"what you should do",14
"783","entrepreneur",20.18,"i could do that",11
"784","entrepreneur",20.18,"they would like to",11
"785","entrepreneur",19,"to get to know",11
"786","entrepreneur",18.77,"they want you to",13
"787","entrepreneur",18.75,"is it that you",12
"788","entrepreneur",18.69,"at the start of",13
"789","entrepreneur",18.64,"going to steal your",11
"790","entrepreneur",18.55,"i hope this helps",11
"791","environment",24,"slap on the wrist",14
"792","environment",23.82,"a slap on the",11
"793","environment",20.06,"fuck is wrong with",16
"794","environment",20.06,"the fuck is wrong",16
"795","environment",19.58,"i just don't understand",12
"796","environment",19.47,"we can do is",19
"797","environment",19,"way out of the",14
"798","environment",16.92,"they don't have any",13
"799","environment",16.92,"we all have to",12
"800","environment",16.27,"and a few other",11
"801","europe",41.33,"put the past behind",15
"802","europe",39,"the past behind us",16
"803","europe",38.54,"take to put the",13
"804","europe",38.54,"will take to put",13
"805","europe",38.42,"edit: thanks for the",12
"806","europe",37.14,"to put the past",14
"807","europe",33.25,"it will take to",16
"808","europe",32.55,"on the wrong side",11
"809","europe",30.91,"side of the world",11
"810","europe",30.59,"think it will take",17
"811","everymanshouldknow",58.31,"you know why i",13
"812","everymanshouldknow",34.45,"are a couple of",11
"813","everymanshouldknow",27.73,"you can help it",11
"814","everymanshouldknow",26.77,"me a lot of",13
"815","everymanshouldknow",26.36,"you want to use",11
"816","everymanshouldknow",25.71,"it's going to be",21
"817","everymanshouldknow",25.62,"the goal is to",13
"818","everymanshouldknow",25.2,"if you're interested in",15
"819","everymanshouldknow",25.17,"want to be the",18
"820","everymanshouldknow",24.92,"i don't know a",12
"821","explainlikeimfive",91.85,"for the gold i",13
"822","explainlikeimfive",91.27,"for the gold stranger",11
"823","explainlikeimfive",91.27,"thanks for the gold",92
"824","explainlikeimfive",89.83,"you for the gold",18
"825","explainlikeimfive",83.78,"for the gold kind",23
"826","explainlikeimfive",82.93,"the gold kind stranger",15
"827","explainlikeimfive",79.33,"thank you kind stranger",12
"828","explainlikeimfive",74.65,"edit: thanks for the",74
"829","explainlikeimfive",69.87,"edit: thank you for",15
"830","explainlikeimfive",66.75,"to be a big",12
"831","facepalm",58.53,"like it is but",15
"832","facepalm",56.38,"think it be like",16
"833","facepalm",55.57,"is but it do",14
"834","facepalm",53.82,"be like it is",17
"835","facepalm",53.82,"it be like it",17
"836","facepalm",53.59,"don't think it be",17
"837","facepalm",50.5,"they don't think it",16
"838","facepalm",44,"it is but it",18
"839","facepalm",37.27,"why i came here",11
"840","facepalm",37.18,"they say the more",11
"841","fallout",52.36,"fallout 3 kill everything",11
"842","fallout",47.67,"theoretical degree in physics",15
"843","fallout",45.93,"a theoretical degree in",15
"844","fallout",40.45,"i swear to god",11
"845","fallout",38.74,"mojave almost makes you",27
"846","fallout",38.27,"my favorite parts of",11
"847","fallout",36.72,"the mojave almost makes",29
"848","fallout",35.91,"i think it'd be",11
"849","fallout",35.82,"degenerates like you belong",11
"850","fallout",35.64,"if you have high",11
"851","fantasyfootball",66.91,"the player's bye week",11
"852","fantasyfootball",66.91,"their rank based on",11
"853","fantasyfootball",66.91,"their value val: player",11
"854","fantasyfootball",66.91,"tier tiers are established",11
"855","fantasyfootball",66.91,"to a baseline player",11
"856","fantasyfootball",66.91,"val: player value the",11
"857","fantasyfootball",66.91,"value the average value",11
"858","fantasyfootball",66.91,"value val: player value",11
"859","fantasyfootball",66.91,"week adp: the player's",11
"860","fantasyfootball",66.91,"what do the columns",11
"861","fantheories",50.55,"i like it it",11
"862","fantheories",45.83,"a large part of",12
"863","fantheories",44.5,"name is robert paulson",16
"864","fantheories",43.45,"at the hands of",11
"865","fantheories",39.64,"we also know that",11
"866","fantheories",38.64,"of the human race",11
"867","fantheories",37.33,"it's not a fan",12
"868","fantheories",36.73,"that kind of thing",15
"869","fantheories",36.65,"of the movie he",17
"870","fantheories",36.35,"some point in the",17
"871","fffffffuuuuuuuuuuuu",47.45,"at me and said",11
"872","fffffffuuuuuuuuuuuu",46.09,"if this is true",11
"873","fffffffuuuuuuuuuuuu",43.64,"there was a guy",11
"874","fffffffuuuuuuuuuuuu",41.36,"must have been a",11
"875","fffffffuuuuuuuuuuuu",36.5,"they thought i was",12
"876","fffffffuuuuuuuuuuuu",36.35,"everything went better than",17
"877","fffffffuuuuuuuuuuuu",36.29,"you were supposed to",14
"878","fffffffuuuuuuuuuuuu",34.31,"this is a true",16
"879","fffffffuuuuuuuuuuuu",33.92,"a long time i",13
"880","fffffffuuuuuuuuuuuu",33.67,"to do something about",15
"881","fiftyfifty",31.91,"who wanted to see",11
"882","fiftyfifty",30.92,"why is it never",13
"883","fiftyfifty",30.47,"soon as i saw",15
"884","fiftyfifty",28.18,"love shrek is life",17
"885","fiftyfifty",28.18,"shrek is love shrek",17
"886","fiftyfifty",28.17,"is love shrek is",18
"887","fiftyfifty",26.55,"i would have to",11
"888","fiftyfifty",25.18,"that i wanted to",11
"889","fiftyfifty",25.17,"i don't even have",12
"890","fiftyfifty",25.17,"is it never the",12
"891","firstworldanarchists",68.19,"gets it ^^bot_info http://iimgurcom/dkbh7cigif",53
"892","firstworldanarchists",45.45,"get it ^^bot_info http://iimgurcom/dkbh7cigif",11
"893","firstworldanarchists",39.58,"tell me what anarchy",12
"894","firstworldanarchists",36.45,"will never be the",11
"895","firstworldanarchists",35.36,"tell us what we",11
"896","firstworldanarchists",35,"result was: tails ^^statistics",28
"897","firstworldanarchists",35,"tails ^^statistics http://coinflipbotre/statsphp ^^|",28
"898","firstworldanarchists",35,"the result was: tails",28
"899","firstworldanarchists",35,"was: tails ^^statistics http://coinflipbotre/statsphp",28
"900","firstworldanarchists",34.92,"to do with this",13
"901","firstworldproblems",38.5,"problem is that you",14
"902","firstworldproblems",35.64,"want to know what",11
"903","firstworldproblems",35.36,"and my gps told",11
"904","firstworldproblems",35.36,"gps told me to",11
"905","firstworldproblems",32.5,"my gps told me",12
"906","firstworldproblems",28.5,"look on the bright",14
"907","firstworldproblems",26.07,"i wish i was",14
"908","firstworldproblems",25.93,"if you can commit",14
"909","firstworldproblems",25.93,"you can commit to",14
"910","firstworldproblems",25.73,"what you get for",11
"911","fitness",75.6,"thanks for the gold",15
"912","fitness",67.56,"edit: thanks for the",16
"913","fitness",64.42,"etc is one of",12
"914","fitness",63.79,"ever need to do",14
"915","fitness",62.5,"for signing up for",12
"916","fitness",62.5,"signing up for /r/germanfacts",12
"917","fitness",62.5,"thank you for signing",12
"918","fitness",62.5,"you for signing up",12
"919","fitness",62.43,"you and very very",14
"920","fitness",62.43,"you will progress way",14
"921","food",38.67,"in a small bowl",15
"922","food",36.25,"it kind of looks",12
"923","food",35.33,"the fuck are you",12
"924","food",34.33,"in a large bowl",18
"925","food",33.46,"baby you got a",13
"926","food",33.46,"on a wire rack",13
"927","food",33.33,"and bring to a",15
"928","food",33.28,"it back in the",18
"929","food",32.43,"the recipe i used",14
"930","food",32,"here is the recipe",12
"931","foodforthought",35.31,"this is something i",13
"932","foodforthought",34.83,"of course you can",12
"933","foodforthought",31.73,"hits the nail on",11
"934","foodforthought",31.25,"the rest of our",12
"935","foodforthought",29.45,"to say it but",11
"936","foodforthought",29.23,"this is where the",13
"937","foodforthought",29.17,"a job at a",12
"938","foodforthought",28.64,"there were a lot",11
"939","foodforthought",28.5,"i felt like i",16
"940","foodforthought",27.73,"take a moment to",11
"941","foodporn",65.62,"minutes or until the",13
"942","foodporn",65.24,"the recipe for anyone",17
"943","foodporn",61.94,"here's the recipe for",18
"944","foodporn",59.45,"recipe for anyone interested",11
"945","foodporn",50.92,"case anyone is interested",12
"946","foodporn",50.45,"the recipe in case",11
"947","foodporn",49.52,"preheat the oven to",25
"948","foodporn",48.86,"and pepper to taste",28
"949","foodporn",47.52,"salt and pepper to",29
"950","foodporn",47.36,"in a large pot",11
"951","freebies",24.38,"never heard of it",16
"952","freebies",23.15,"i can finally get",13
"953","freebies",22.38,"""thank you for your",13
"954","freebies",20.82,"for the people who",11
"955","freebies",18.53,"fill out the form",17
"956","freebies",17.75,"what it looks like",12
"957","freebies",17.57,"talk like a pirate",14
"958","freebies",17.27,"to fill out the",11
"959","freebies",17.26,"this is going to",31
"960","freebies",16.59,"as long as the",17
"961","frugal",50.71,"is a great resource",14
"962","frugal",46.5,"in the same time",12
"963","frugal",41.09,"a big difference between",11
"964","frugal",39.5,"eggs in one basket",12
"965","frugal",38.25,"point of being frugal",12
"966","frugal",37.77,"it turns out to",13
"967","frugal",37.42,"trying to get out",12
"968","frugal",37,"a pack a day",12
"969","frugal",36.79,"and a half and",14
"970","frugal",36.64,"do a bit of",11
"971","frugalmalefashion",26.82,"can i find a",11
"972","frugalmalefashion",20.09,"this is not a",11
"973","frugalmalefashion",16.75,"go on sale and",12
"974","frugalmalefashion",16.69,"you want to go",16
"975","frugalmalefashion",16.45,"turned out to be",11
"976","frugalmalefashion",15.36,"free shipping and returns",11
"977","frugalmalefashion",15,"in the end i",11
"978","frugalmalefashion",14.47,"they also have a",15
"979","frugalmalefashion",14.05,"for those of us",22
"980","frugalmalefashion",13.79,"sure if this is",14
"981","fullmoviesonyoutube",10.82,"this was the first",11
"982","fullmoviesonyoutube",10,"of the best movies",12
"983","fullmoviesonyoutube",9.41,"i think it was",17
"984","fullmoviesonyoutube",9.07,"i have ever seen",15
"985","fullmoviesonyoutube",8.64,"the man from earth",14
"986","fullmoviesonyoutube",8.15,"this movie is the",13
"987","fullmoviesonyoutube",7.64,"| france | |",11
"988","fullmoviesonyoutube",7.48,"one of the greatest",29
"989","fullmoviesonyoutube",7.43,"| | mexico |",14
"990","fullmoviesonyoutube",7.07,"one of my favourite",14
"991","funny",84.36,"edit: thanks for the",39
"992","funny",84.31,"thanks for the gold",54
"993","funny",73.83,"i told him i",12
"994","funny",70.36,"nothing to me but",11
"995","funny",68.79,"ooh piece of candy",14
"996","funny",66.18,"been involved in numerous",11
"997","funny",66.18,"involved in numerous secret",11
"998","funny",65.71,"from one of the",14
"999","funny",64.69,"all you need to",13
"1000","funny",62.91,"to the grand canyon",11
"1001","futurama",44.92,"bender then flexo then",12
"1002","futurama",44.73,"first bender then flexo",11
"1003","futurama",44.73,"then flexo then fry",11
"1004","futurama",43.38,"the back of our",16
"1005","futurama",43.2,"back of our minds",15
"1006","futurama",43.2,"be sweet for a",15
"1007","futurama",43.2,"it would be sweet",15
"1008","futurama",43.2,"sweet for a while",15
"1009","futurama",43.2,"while but in the",15
"1010","futurama",43.2,"would be sweet for",15
"1011","futurology",98.83,"science graphics here https://wwwflickrcom/photos/47808265@n08/",12
"1012","futurology",96.44,"\u27a4 more science graphics",25
"1013","futurology",94.79,"links are here: \u27a4",14
"1014","futurology",93.52,"more science graphics here",23
"1015","futurology",92,"here is this week",11
"1016","futurology",92,"is this week in",11
"1017","futurology",68.25,"links clickable image http://suturaio/weekly/",12
"1018","futurology",63.86,"direct to your inbox",14
"1019","futurology",61.54,"everyone here is this",13
"1020","futurology",61.54,"hey everyone here is",13
"1021","gadgets",27.71,"going to get the",14
"1022","gadgets",23.94,"for the love of",16
"1023","gadgets",23.52,"eyes off the road",21
"1024","gadgets",23.5,"not a bad idea",14
"1025","gadgets",22.06,"that there is an",17
"1026","gadgets",21.45,"be more likely to",11
"1027","gadgets",21.31,"in the world that",13
"1028","gadgets",21.18,"that there was a",11
"1029","gadgets",20.83,"i'll believe it when",12
"1030","gadgets",20.58,"just in time for",12
"1031","gamedeals",78.68,"know directly at contact@humblebundlecom",22
"1032","gamedeals",78.68,"let us know directly",22
"1033","gamedeals",78.68,"us know directly at",22
"1034","gamedeals",70.45,"during the sale if",11
"1035","gamedeals",70.36,"issues please let us",14
"1036","gamedeals",68.27,"the steam summer sale:",11
"1037","gamedeals",68.08,"any questions or issues",13
"1038","gamedeals",68.08,"or issues please let",13
"1039","gamedeals",68.08,"questions or issues please",13
"1040","gamedeals",66.14,"the average price and",14
"1041","gamedev",27.55,"it for the money",11
"1042","gamedev",26.27,"on a piece of",11
"1043","gamedev",24.77,"i don't care if",13
"1044","gamedev",23.82,"what do you want",11
"1045","gamedev",23.75,"does a great job",12
"1046","gamedev",23.64,"not the kind of",11
"1047","gamedev",23.29,"my friend and i",14
"1048","gamedev",22.82,"to take it down",11
"1049","gamedev",22.8,"of the game the",15
"1050","gamedev",22.5,"of the games industry",12
"1051","gameofthrones",100,"thanks for the gold",11
"1052","gameofthrones",63.17,"edit: thanks for the",12
"1053","gameofthrones",62.55,"gods i was strong",11
"1054","gameofthrones",60.08,"\u0f3c \u3064 \u25d5_\u25d5 \u0f3d\u3064",13
"1055","gameofthrones",58.83,"to the wrong place""",12
"1056","gameofthrones",58.64,"i shall wear no",11
"1057","gameofthrones",57.67,"should have stayed in",12
"1058","gameofthrones",57.54,"i was strong then",13
"1059","gameofthrones",57.38,"no crowns and win",13
"1060","gameofthrones",57.38,"wear no crowns and",13
"1061","games",79.91,"for those who can't",11
"1062","games",71,"take full advantage of",11
"1063","games",70.92,"a lot of resources",12
"1064","games",65.83,"he's going to be",12
"1065","games",64.73,"you think of the",11
"1066","games",64.27,"into a game that",11
"1067","games",63.64,"one of the devs",11
"1068","games",62.91,"finish the game but",11
"1069","games",62.27,"you don't own the",11
"1070","games",62,"amount of time it",14
"1071","gaming",92.71,"thanks for the gold",41
"1072","gaming",77.7,"edit: thanks for the",30
"1073","gaming",72.08,"going to need a",12
"1074","gaming",67.45,"are a ton of",11
