"","subreddit","score","ngram","occurrences"
"2101","scifi",34.88,"end of the film",17
"2102","scifi",33.85,"of the original series",20
"2103","scifi",33.27,"much as it is",11
"2104","scifi",32.36,"out on a limb",11
"2105","scifi",32,"is that if you",12
"2106","scifi",30.85,"the statue of liberty",13
"2107","scifi",29.56,"day the earth stood",16
"2108","scifi",29.27,"at least some of",11
"2109","scifi",28.23,"the day the earth",13
"2110","scifi",28.23,"the earth stood still",13
"2111","seduction",33.15,"you look like the",13
"2112","seduction",30.75,"the both of you",16
"2113","seduction",30.54,"at least you know",13
"2114","seduction",30.33,"with a woman and",15
"2115","seduction",30.29,"sounds like she was",14
"2116","seduction",30.09,"to call you out",11
"2117","seduction",29.67,"i don't mean that",12
"2118","seduction",29.21,"most important thing in",14
"2119","seduction",29.18,"looking at me like",11
"2120","seduction",28.82,"the reason for this",11
"2121","self",38.38,"there is a very",13
"2122","self",38,"and we had a",12
"2123","self",37.09,"you can see it",11
"2124","self",36,"of the time when",11
"2125","self",36,"thing happen to me",11
"2126","self",34.44,"today you tomorrow me",18
"2127","self",33.82,"when you need it",11
"2128","self",33.73,"if you can make",11
"2129","self",33.58,"on the edge of",12
"2130","self",33.55,"for the last two",11
"2131","sex",79.63,"thanks for the gold",19
"2132","sex",58.55,"the spirit is willing",11
"2133","sex",57.31,"out of your system",13
"2134","sex",57.06,"to the men who",16
"2135","sex",56.79,"want you to cum",14
"2136","sex",56.25,"edit: thanks for the",16
"2137","sex",55.38,"you to the men",16
"2138","sex",54.91,"thank you to the",22
"2139","sex",54.14,"her in the face",14
"2140","sex",53.55,"as a sign of",11
"2141","shittyaskscience",45.33,"in the southern hemisphere",12
"2142","shittyaskscience",41.45,"side of the moon",11
"2143","shittyaskscience",40.94,"in an attempt to",17
"2144","shittyaskscience",38.45,"make sure you have",11
"2145","shittyaskscience",38.31,"the fact that they",13
"2146","shittyaskscience",37.91,"does that mean i'm",11
"2147","shittyaskscience",36.38,"in the united states",13
"2148","shittyaskscience",36.27,"in the northern hemisphere",15
"2149","shittyaskscience",35.74,"is known as the",19
"2150","shittyaskscience",34.73,"you can clearly see",11
"2151","showerthoughts",71.69,"in the right places",16
"2152","showerthoughts",69.73,"down you pass it",11
"2153","showerthoughts",69.73,"one down you pass",11
"2154","showerthoughts",69.73,"take one down you",11
"2155","showerthoughts",68.75,"touch my phone in",12
"2156","showerthoughts",67.45,"phone in the right",11
"2157","showerthoughts",64.71,"beer you take one",17
"2158","showerthoughts",64.71,"of beer you take",17
"2159","showerthoughts",64.71,"you take one down",17
"2160","showerthoughts",64.44,"thanks for the gold",18
"2161","shutupandtakemymoney",22.82,"for a piece of",11
"2162","shutupandtakemymoney",22,"take a picture of",11
"2163","shutupandtakemymoney",21.23,"i feel like the",13
"2164","shutupandtakemymoney",20.65,"thought this was a",17
"2165","shutupandtakemymoney",20.33,"has a lot of",12
"2166","shutupandtakemymoney",19.82,"if anyone is interested",11
"2167","shutupandtakemymoney",19.47,"the side of the",15
"2168","shutupandtakemymoney",18.75,"of these and they",12
"2169","shutupandtakemymoney",18.6,"but i don't see",15
"2170","shutupandtakemymoney",17.79,"you look like a",14
"2171","skincareaddiction",25.55,"with water in the",11
"2172","skincareaddiction",25.27,"go see a doctor",11
"2173","skincareaddiction",25.14,"baking soda and lemon",14
"2174","skincareaddiction",25.08,"go see a dermatologist",12
"2175","skincareaddiction",24.74,"a lot of these",19
"2176","skincareaddiction",24.71,"in the morning if",14
"2177","skincareaddiction",24.61,"had to go to",23
"2178","skincareaddiction",24.52,"care of your skin",21
"2179","skincareaddiction",24.08,"soda and lemon juice",12
"2180","skincareaddiction",23.91,"i woke up with",11
"2181","skyrim",54.68,"unfortunately i am the",31
"2182","skyrim",52.44,"a strong nord woman",18
"2183","skyrim",48.5,"to kill a dragon",14
"2184","skyrim",48,"archmage of the college",11
"2185","skyrim",47.93,"the sight of a",28
"2186","skyrim",45.88,"am the high king",49
"2187","skyrim",45.36,"can't stand the sight",25
"2188","skyrim",45.35,"sight of a strong",23
"2189","skyrim",44.75,"i am the high",48
"2190","skyrim",44.55,"their tongue he is",11
"2191","slowcooking",35.67,"1 cup heavy cream",12
"2192","slowcooking",28.63,"lbs boneless skinless chicken",16
"2193","slowcooking",22.08,"the meat and the",12
"2194","slowcooking",20.69,"the bottom of your",13
"2195","slowcooking",20.62,"boneless skinless chicken breast",13
"2196","slowcooking",20.55,"4 cloves of garlic",11
"2197","slowcooking",19.43,"for 8 hours or",14
"2198","slowcooking",19.32,"boneless skinless chicken breasts",37
"2199","slowcooking",19,"freshly ground black pepper",16
"2200","slowcooking",18.91,"the same thing as",11
"2201","smashbros",100,"full text: pic of",21
"2202","smashbros",100,"text: pic of the",21
"2203","smashbros",93.82,"appear here http://wwwsmashbroscom/update/images/daily-enjpg original",11
"2204","smashbros",93.82,"eventually appear here http://wwwsmashbroscom/update/images/daily-enjpg",11
"2205","smashbros",93.82,"here http://wwwsmashbroscom/update/images/daily-enjpg original miiverse",11
"2206","smashbros",93.82,"http://wwwsmashbroscom/update/images/daily-enjpg original miiverse picture",11
"2207","smashbros",92.97,"post in miiverse's comments",37
"2208","smashbros",92.97,"sakurai post in miiverse's",37
"2209","smashbros",92.76,"extra sakurai post in",38
"2210","smashbros",86.07,"picture the high quality",14
"2211","soccer",100,"______________________________________ second half highlights:",16
"2212","soccer",100,"-gifs will be updated",14
"2213","soccer",100,"and i'll try to",11
"2214","soccer",100,"be updated here throughout",17
"2215","soccer",100,"here throughout the match-",17
"2216","soccer",100,"i'll try to get",11
"2217","soccer",100,"updated here throughout the",17
"2218","soccer",100,"will be updated here",17
"2219","soccer",97.44,"gets a yellow card",16
"2220","soccer",89.88,"thanks for the gold",17
"2221","southpark",30,"am lorde ya ya",11
"2222","southpark",29.5,"little bit of cancer",12
"2223","southpark",25.15,"don't wanna sound like",13
"2224","southpark",25.15,"i don't wanna sound",13
"2225","southpark",25.15,"wanna sound like a",13
"2226","southpark",25,"but it was a",12
"2227","southpark",24.91,"have to deal with",11
"2228","southpark",24.69,"lorde ya ya ya",13
"2229","southpark",24.62,"end of the episode",13
"2230","southpark",23.96,"thought this was america",28
"2231","space",82.6,"thanks for the gold",15
"2232","space",51,"edit: thanks for the",14
"2233","space",37.75,"every human being who",12
"2234","space",36.27,"do not know the",11
"2235","space",36.17,"space exploration is a",12
"2236","space",35.82,"one of the very",11
"2237","space",35.48,"the same way that",23
"2238","space",35.33,"and this is a",12
"2239","space",34.5,"human being who ever",12
"2240","space",34.08,"i've never seen this",13
"2241","spaceporn",33.46,"| faq http://wwwredditcom/r/faqs/comments/1ninoq/uastrobot_faq/ |",13
"2242","spaceporn",33.46,"| feedback http://wwwredditcom/message/composeto=astro-bot |",13
"2243","spaceporn",33.46,"faq http://wwwredditcom/r/faqs/comments/1ninoq/uastrobot_faq/ | nbsp;^1",13
"2244","spaceporn",33.46,"feedback http://wwwredditcom/message/composeto=astro-bot | faq",13
"2245","spaceporn",33.46,"http://wwwredditcom/message/composeto=astro-bot | faq http://wwwredditcom/r/faqs/comments/1ninoq/uastrobot_faq/",13
"2246","spaceporn",33.46,"http://wwwredditcom/r/faqs/comments/1ninoq/uastrobot_faq/ | nbsp;^1 tags",13
"2247","spaceporn",31.21,"| nbsp;^1 tags may",14
"2248","spaceporn",31.21,"nbsp;^1 tags may overlap",14
"2249","spaceporn",31.21,"show_const_names=1 show_galaxies=1 img_source=sky-map powered",14
"2250","spaceporn",31.21,"show_galaxies=1 img_source=sky-map powered by",14
"2251","sports",48.29,"edit: thanks for the",14
"2252","sports",47.67,"i believe that we",21
"2253","sports",46.28,"believe that we will",18
"2254","sports",44.08,"that we will win",13
"2255","sports",37.21,"on the part of",14
"2256","sports",36.27,"how do you not",11
"2257","sports",36.17,"i love the fact",12
"2258","sports",35.75,"understanding of the game",12
"2259","sports",33.67,"love the fact that",12
"2260","sports",30.14,"win the world cup",14
"2261","standupshots",35,"think this is the",12
"2262","standupshots",33.82,"would have been a",11
"2263","standupshots",32.58,"you should check out",12
"2264","standupshots",29.55,"the only time i",11
"2265","standupshots",28.5,"a great way to",12
"2266","standupshots",28.43,"follow me on twitter",37
"2267","standupshots",28.23,"i would have to",13
"2268","standupshots",27.33,"would love to hear",12
"2269","standupshots",27.31,"a bit of an",13
"2270","standupshots",27.08,"the idea of a",13
"2271","starcraft",80.47,"chan not sure what",15
"2272","starcraft",80.47,"connection to main chan",15
"2273","starcraft",80.47,"error lost connection to",15
"2274","starcraft",80.47,"lost connection to main",15
"2275","starcraft",80.47,"main chan not sure",15
"2276","starcraft",80.47,"to main chan not",15
"2277","starcraft",80,"sure what to upvote",14
"2278","starcraft",80,"what to upvote anymore",14
"2279","starcraft",57.65,"not sure what to",23
"2280","starcraft",54,"feel free to add",12
"2281","starwars",50.82,"reach look as good",11
"2282","starwars",50.82,"you reach look as",11
"2283","starwars",44.73,"good you will not",15
"2284","starwars",42.64,"but it checks out",11
"2285","starwars",42.29,"look as good you",14
"2286","starwars",41.63,"as good you will",16
"2287","starwars",39.42,"years old you reach",12
"2288","starwars",38.13,"where it counts kid",15
"2289","starwars",35.18,"part of the prequels",11
"2290","starwars",34,"for the last time",12
"2291","steam",31,"be that guy but",11
"2292","steam",31,"left 4 dead 3",20
"2293","steam",29.57,"it looks like the",21
"2294","steam",28.83,"lot of games that",12
"2295","steam",28.82,"of games that i",11
"2296","steam",27,"just a heads up",11
"2297","steam",26.87,"you need a budget",15
"2298","steam",26.18,"to work on it",11
"2299","steam",26.08,"one of the top",12
"2300","steam",25.82,"daily or flash sale",11
"2301","subredditdrama",62.25,"any news source especially",16
"2302","subredditdrama",62.25,"much any news source",16
"2303","subredditdrama",62.25,"news source especially a",16
"2304","subredditdrama",62.25,"pretty much any news",16
"2305","subredditdrama",60.93,"how taxonomy works they're",14
"2306","subredditdrama",60.93,"not how taxonomy works",14
"2307","subredditdrama",60.93,"taxonomy works they're both",14
"2308","subredditdrama",60.93,"that's not how taxonomy",14
"2309","subredditdrama",60.82,"science no one calls",17
"2310","subredditdrama",60.65,"family"" you're referring to",17
"2311","subredditoftheday",29.58,"is the subreddit of",12
"2312","subredditoftheday",19.73,"to be honest i",11
"2313","subredditoftheday",19.36,"a part of it",11
"2314","subredditoftheday",18,"of the day for",11
"2315","subredditoftheday",15.21,"a few months ago",14
"2316","subredditoftheday",15,"a few weeks ago",14
"2317","subredditoftheday",14.25,"director of sciences and",16
"2318","subredditoftheday",14.25,"nwo director of sciences",16
"2319","subredditoftheday",14.25,"of sciences and shilling",16
"2320","subredditoftheday",14.07,"i had no idea",15
"2321","talesfromretail",53,"to see what was",11
"2322","talesfromretail",46.73,"how may i help",11
"2323","talesfromretail",45.55,"""what am i getting",11
"2324","talesfromretail",45.55,"am i getting for",11
"2325","talesfromretail",45.55,"i getting for free""",11
"2326","talesfromretail",45.18,"there was a guy",11
"2327","talesfromretail",43.77,"how dare you not",13
"2328","talesfromretail",42.64,"was more of a",14
"2329","talesfromretail",42.33,"can i do for",12
"2330","talesfromretail",42.15,"told her it was",13
"2331","talesfromtechsupport",66.21,"thanks for the gold",14
"2332","talesfromtechsupport",63.54,"i'd love to hear",13
"2333","talesfromtechsupport",50.08,"to see what the",12
"2334","talesfromtechsupport",47.5,"guy on the phone",12
"2335","talesfromtechsupport",47,"not going to do",14
"2336","talesfromtechsupport",45.73,"what was in the",11
"2337","talesfromtechsupport",45.38,"i tried to explain",16
"2338","talesfromtechsupport",44.73,"tech support in the",11
"2339","talesfromtechsupport",43.91,"can you help me",11
"2340","talesfromtechsupport",43.25,"this is where you",16
"2341","tattoos",39.85,"made on personal appearance",13
"2342","tattoos",35.64,"the artist not the",11
"2343","tattoos",26.17,"wanted it to be",12
"2344","tattoos",24.45,"i like how you",11
"2345","tattoos",24.43,"that the tattoo is",14
"2346","tattoos",24.25,"i like it i",12
"2347","tattoos",24,"the story behind the",12
"2348","tattoos",23.62,"it's a beautiful piece",13
"2349","tattoos",23.5,"like to see more",12
"2350","tattoos",23.25,"it was supposed to",12
"2351","technology",96.79,"you for the gold",19
"2352","technology",91.1,"thanks for the gold",77
"2353","technology",87.07,"edit: thank you for",15
"2354","technology",84.57,"edit: thanks for the",61
"2355","technology",78.36,"going to do this",11
"2356","technology",76.33,"what are you gonna",15
"2357","technology",74.73,"took a look at",11
"2358","technology",68.82,"i found out that",11
"2359","technology",68.44,"are you gonna do",16
"2360","technology",66.73,"fastest internet in the",11
"2361","television",94.33,"thanks for the gold",12
"2362","television",68.57,"edit: thanks for the",14
"2363","television",49.25,"long it would take",12
"2364","television",47.21,"all you need to",14
"2365","television",47,"and you get to",13
"2366","television",46.82,"funniest things i've ever",11
"2367","television",46.79,"how long it would",14
"2368","television",44.73,"never won an emmy",11
"2369","television",44.52,"nail on the head",21
"2370","television",43.64,"whether or not they",11
"2371","tf2",67.33,"fear no man but",12
"2372","tf2",59,"\u2551\u265c \u265e \u265d \u265b",11
"2373","tf2",59,"\u265c 7 \u2551\u265f \u265f",11
"2374","tf2",59,"\u265e \u265d \u265b \u265a",11
"2375","tf2",59,"\u265f \u265f \u265f 6",11
"2376","tf2",59,"\u265f \u265f 6 \u2551\u2026",11
"2377","tf2",59,"\u265f 6 \u2551\u2026 \u2026",11
"2378","tf2",59,"7 \u2551\u265f \u265f \u265f",11
"2379","tf2",59,"8 \u2551\u265c \u265e \u265d",11
"2380","tf2",56.55,"\u2658 \u2657 \u2655 \u2654",11
"2381","thathappened",74.73,"stormed out of the",11
"2382","thathappened",72,"into the room and",12
"2383","thathappened",63.91,"me in the face",11
"2384","thathappened",63.08,"never tells but let's",13
"2385","thathappened",63.08,"tells but let's just",13
"2386","thathappened",61.64,"years i can confirm",11
"2387","thathappened",61.08,"mature for my age",12
"2388","thathappened",56.83,"ah it is to",12
"2389","thathappened",56.83,"it is to laugh",12
"2390","thathappened",56.22,"out of the room",18
"2391","thelastairbender",53,"from your other self",11
"2392","thelastairbender",53,"save yourself from your",11
"2393","thelastairbender",53,"to save yourself from",11
"2394","thelastairbender",53,"yourself from your other",11
"2395","thelastairbender",53,"yourself to save yourself",11
"2396","thelastairbender",50.91,"only then will your",11
"2397","thelastairbender",50.91,"then will your true",11
"2398","thelastairbender",50.91,"will your true self",11
"2399","thelastairbender",50.91,"your true self reveal",11
"2400","thelastairbender",49.67,"your other self only",12
"2401","thewalkingdead",73.67,"stupid when they find",12
"2402","thewalkingdead",62,"pretty stupid when they",11
"2403","thewalkingdead",59,"feel pretty stupid when",12
"2404","thewalkingdead",45.47,"screwing with the wrong",19
"2405","thewalkingdead",43.09,"the fact that she's",11
"2406","thewalkingdead",42.18,"episode of the season",11
"2407","thewalkingdead",41.92,"will be able to",12
"2408","thewalkingdead",41.82,"where the fuck is",22
"2409","thewalkingdead",41.5,"with the wrong people""",18
"2410","thewalkingdead",41.06,"in the history of",17
"2411","tifu",83.43,"edit: thanks for the",21
"2412","tifu",66.22,"thanks for the gold",36
"2413","tifu",61,"that you fucking retard",17
"2414","tifu",58.55,"him out of the",11
"2415","tifu",57,"she was about to",12
"2416","tifu",55.58,"up to him and",12
"2417","tifu",54.27,"not sure what he",11
"2418","tifu",54.27,"sure what he had",11
"2419","tifu",54.27,"tell you when i",11
"2420","tifu",54.27,"you when i find",11
"2421","tipofmytongue",57.55,"decided to use even",11
"2422","tipofmytongue",57.55,"to use even go",11
"2423","tipofmytongue",56.55,"use even go want",11
"2424","tipofmytongue",25.09,"blast from the past",11
"2425","tipofmytongue",22.08,"it was going to",13
"2426","tipofmytongue",20.36,"is what you're looking",11
"2427","tipofmytongue",19.57,"was one of the",23
"2428","tipofmytongue",19.31,"that it was a",13
"2429","tipofmytongue",18.55,"this is why i",11
"2430","tipofmytongue",17.29,"it could have been",14
"2431","todayilearned",100,"you for the gold",18
"2432","todayilearned",95.06,"edit: thank you for",17
"2433","todayilearned",84.38,"here is the relevant",13
"2434","todayilearned",82.67,"thanks for the gold",52
"2435","todayilearned",81.55,"is the relevant text",11
"2436","todayilearned",81.55,"relevant text from the",11
"2437","todayilearned",81.55,"text from the wikipedia",11
"2438","todayilearned",81.55,"the relevant text from",11
"2439","todayilearned",79.29,"for the gold kind",14
"2440","todayilearned",78.42,"edit: thanks for the",36
"2441","topgear",39.27,"could be taken as",11
"2442","topgear",35.25,"to be fair i",12
"2443","topgear",34,"i wear a hat",16
"2444","topgear",33.64,"my favorite top gear",11
"2445","topgear",33.09,"james wears a hat",11
"2446","topgear",32.45,"were close to the",11
"2447","topgear",32.06,"to start with hello",17
"2448","topgear",30.27,"number plate of the",11
"2449","topgear",30.27,"on the number plate",11
"2450","topgear",30.27,"the number plate of",11
"2451","travel",22.46,"the guy on the",13
"2452","travel",21.77,"just a bunch of",13
"2453","travel",21.54,"me when i was",13
"2454","travel",21.5,"but this is the",12
"2455","travel",21.25,"no such thing as",12
"2456","travel",21.08,"but as soon as",12
"2457","travel",20.93,"might be a bit",14
"2458","travel",20.36,"in the states and",11
"2459","travel",20,"i'm not saying that",11
"2460","travel",20,"this is the most",12
"2461","trees",58.21,"thanks for the gold",19
"2462","trees",57.67,"edit: thanks for the",12
"2463","trees",45.15,"you look like a",13
"2464","trees",43.33,"those of us who",15
"2465","trees",42.94,"i'd be happy to",16
"2466","trees",41.75,"then i spoke to",12
"2467","trees",41.45,"first time i took",11
"2468","trees",40.75,"on getting doug with",12
"2469","trees",40.67,"what is this a",12
"2470","trees",40.55,"to get stoned and",11
"2471","trollxchromosomes",66.17,"thanks for the gold",12
"2472","trollxchromosomes",52.45,"and he was like",11
"2473","trollxchromosomes",48.21,"didn't want to get",14
"2474","trollxchromosomes",47.7,"what the actual fuck",20
"2475","trollxchromosomes",44.92,"no for an answer",13
"2476","trollxchromosomes",43.58,"when i told my",12
"2477","trollxchromosomes",41.5,"i dated a guy",12
"2478","trollxchromosomes",41.36,"be the one to",11
"2479","trollxchromosomes",41.15,"the best part is",13
"2480","trollxchromosomes",40.67,"he was going to",15
"2481","truegaming",42.31,"in many ways but",13
"2482","truegaming",42,"they have no idea",13
"2483","truegaming",41.64,"you get too close",11
"2484","truegaming",40.25,"that as much as",12
"2485","truegaming",39.91,"and only if you",11
"2486","truegaming",39.09,"to pull this off",11
"2487","truegaming",39.09,"want to know about",11
"2488","truegaming",39,"we take for granted",11
"2489","truegaming",37.91,"playing the game not",11
"2490","truegaming",37.08,"i may or may",13
"2491","truereddit",74.07,"thanks for the gold",14
"2492","truereddit",49.56,"edit: thanks for the",16
"2493","truereddit",48.57,"i want to have",14
"2494","truereddit",47.25,"of a society that",12
"2495","truereddit",46.53,"for so long that",17
"2496","truereddit",45.5,"has every right to",12
"2497","truereddit",44.91,"me a long time",11
"2498","truereddit",44.23,"of looking at the",13
"2499","truereddit",44.17,"isn't meant to be",12
"2500","truereddit",43.62,"get back to work",13
"2501","tumblrinaction",80.82,"thanks for the gold",17
"2502","tumblrinaction",76.44,"edit: thanks for the",16
"2503","tumblrinaction",64.4,"the told republic x",15
"2504","tumblrinaction",63.86,"city of told x",14
"2505","tumblrinaction",63.86,"told and silver x",14
"2506","tumblrinaction",63.86,"x pokemon told and",14
"2507","tumblrinaction",63.42,"tolderhood x battletolds x",12
"2508","tumblrinaction",63.42,"unreal toldament x stone-told",12
"2509","tumblrinaction",63.42,"x battletolds x stalker:",12
"2510","tumblrinaction",63.42,"x stone-told steve austin",12
"2511","twoxchromosomes",70.56,"thanks for the gold",18
"2512","twoxchromosomes",67.91,"date with a guy",11
"2513","twoxchromosomes",65.09,"edit: thank you for",11
"2514","twoxchromosomes",61.82,"edit: thanks for the",11
"2515","twoxchromosomes",61.67,"of us one of",12
"2516","twoxchromosomes",61.5,"and asked if i",14
"2517","twoxchromosomes",60.08,"and told him to",13
"2518","twoxchromosomes",52.79,"went on a date",14
"2519","twoxchromosomes",51.91,"me to go out",11
"2520","twoxchromosomes",51.78,"him to fuck off",18
"2521","unexpected",37.82,"it was actually a",11
"2522","unexpected",35.73,"you don't need to",15
"2523","unexpected",35.45,"to turn into a",11
"2524","unexpected",34.55,"about this is that",11
"2525","unexpected",33.18,"the majority of people",11
"2526","unexpected",33,"you get used to",12
"2527","unexpected",32.5,"i was in a",14
"2528","unexpected",31.57,"i'm going to go",14
"2529","unexpected",31.57,"with a lot of",14
"2530","unexpected",31.06,"the rest of your",18
"2531","upliftingnews",35.13,"please feel free to",16
"2532","upliftingnews",32.36,"with the help of",11
"2533","upliftingnews",29.86,"my wife and i",21
"2534","upliftingnews",29.82,"that there was a",11
"2535","upliftingnews",29.71,"this is a very",14
"2536","upliftingnews",27,"a place to live",14
"2537","upliftingnews",26.08,"for most of the",13
"2538","upliftingnews",25.5,"rest of his life",12
"2539","upliftingnews",25.36,"read the article and",11
"2540","upliftingnews",24.42,"trying to figure out",12
"2541","videos",97.75,"edit: thank you for",20
"2542","videos",90.71,"thanks for the gold",103
"2543","videos",90.55,"edit: thanks for the",56
"2544","videos",90.5,"you for the gold",26
"2545","videos",89.85,"for the gold stranger",13
"2546","videos",79.92,"i told her i",12
"2547","videos",78.82,"the link to the",17
"2548","videos",77.75,"he just wants to",12
"2549","videos",76.79,"one of my best",14
"2550","videos",76.45,"feel really bad for",11
"2551","wallpaper",13.19,"a lot of the",16
"2552","wallpaper",10.67,"but i don't know",12
"2553","wallpaper",10.31,"in a long time",13
"2554","wallpaper",10.08,"does anyone have a",12
"2555","wallpaper",8.69,"this has been my",13
"2556","wallpaper",8.67,"i've seen in a",12
"2557","wallpaper",8.55,"i just wanted to",11
"2558","wallpaper",8.5,"the shit out of",22
"2559","wallpaper",8.43,"when i saw the",14
"2560","wallpaper",7.91,"what is this a",11
"2561","wallpapers",21.09,"the hell out of",11
"2562","wallpapers",20.23,"to be that guy",13
"2563","wallpapers",18.06,"at the bottom of",16
"2564","wallpapers",17.86,"is going to be",21
"2565","wallpapers",17.67,"but i like it",12
"2566","wallpapers",17.27,"i gave it a",15
"2567","wallpapers",17,"why is there a",12
"2568","wallpapers",16.83,"but i don't know",12
"2569","wallpapers",16.79,"if anyone is interested",19
"2570","wallpapers",16.69,"to get rid of",13
"2571","wearethemusicmakers",27.27,"and i had to",11
"2572","wearethemusicmakers",23,"important part of the",11
"2573","wearethemusicmakers",20.73,"in relation to the",11
"2574","wearethemusicmakers",18.82,"to play for free",11
"2575","wearethemusicmakers",18.25,"do it for the",12
"2576","wearethemusicmakers",18.18,"to take advantage of",11
"2577","wearethemusicmakers",18.17,"too good to be",12
"2578","wearethemusicmakers",17.54,"to focus on the",13
"2579","wearethemusicmakers",17.33,"i don't really care",12
"2580","wearethemusicmakers",17.31,"i had to do",13
"2581","web_design",46.09,"source or provide masterfiles",11
"2582","web_design",42.58,"never sell the source",12
"2583","web_design",42.58,"sell the source or",12
"2584","web_design",42.58,"the source or provide",12
"2585","web_design",30.62,"this is how you",13
"2586","web_design",25.64,"to build a website",11
"2587","web_design",23.42,"be a bit more",12
"2588","web_design",20.95,"to do it for",21
"2589","web_design",19.27,"this is the most",22
"2590","web_design",18.83,"the early days of",12
"2591","whatcouldgowrong",33.9,"rest of his life",21
"2592","whatcouldgowrong",33.77,"to be fair he",13
"2593","whatcouldgowrong",33.17,"guess you could say",12
"2594","whatcouldgowrong",33.09,"than i thought it",11
"2595","whatcouldgowrong",32.09,"i was really hoping",11
"2596","whatcouldgowrong",32,"don't know what the",12
"2597","whatcouldgowrong",31.94,"the face by a",16
"2598","whatcouldgowrong",31.75,"do something like this",12
"2599","whatcouldgowrong",31.38,"i don't think i've",16
"2600","whatcouldgowrong",31.36,"this is how i",14
"2601","whatisthisthing",52.43,"a quick google search",14
"2602","whatisthisthing",41,"like a piece of",12
"2603","whatisthisthing",36.27,"is a picture of",15
"2604","whatisthisthing",33.25,"the left of the",16
"2605","whatisthisthing",33.23,"channel=sb source=lnms tbm=isch sa=x",13
