"","subreddit","score","ngram","occurrences"
"1075","gaming",67.45,"there are a ton",11
"1076","gaming",66,"\u3064 \u25d5_\u25d5 \u0f3d\u3064 give",12
"1077","gaming",62.63,"blade of the windseeker",16
"1078","gaming",62.63,"thunderfury blessed blade of",16
"1079","gaming",61.86,"be real if our",14
"1080","gaming",61.33,"cory in the house",12
"1081","geek",35.55,"i sure as hell",11
"1082","geek",35.18,"dark lord of the",11
"1083","geek",34.58,"the answer to the",12
"1084","geek",33.79,"know what i mean",39
"1085","geek",33.36,"to find out if",11
"1086","geek",32.93,"what you're looking for",15
"1087","geek",32.83,"this is what happens",12
"1088","geek",32.04,"if you know what",46
"1089","geek",30.31,"lord of the sith",13
"1090","geek",29.85,"if you had to",13
"1091","gentlemanboners",69.64,"just take a look",11
"1092","gentlemanboners",61.73,"directly remove this comment",15
"1093","gentlemanboners",61.73,"may directly remove this",15
"1094","gentlemanboners",61.73,"op may directly remove",15
"1095","gentlemanboners",61.73,"remove this comment by",15
"1096","gentlemanboners",61.73,"this comment by clicking",15
"1097","gentlemanboners",61,"by clicking ^here http://wwwredditcom/message/compose/to=qualityenforcer",11
"1098","gentlemanboners",61,"comment by clicking ^here",11
"1099","gentlemanboners",42.75,"if you have a",16
"1100","gentlemanboners",31.46,"biggest crush on her",13
"1101","getdisciplined",28.09,"is going to sound",11
"1102","getdisciplined",26.67,"i want to say",12
"1103","getdisciplined",22.8,"have to do with",15
"1104","getdisciplined",22.54,"is up to you",13
"1105","getdisciplined",21.83,"the only one that",12
"1106","getdisciplined",21.5,"doing the right thing",14
"1107","getdisciplined",21.19,"go back to the",16
"1108","getdisciplined",20.67,"think of yourself as",12
"1109","getdisciplined",20.08,"do what needs to",12
"1110","getdisciplined",20,"i was one of",12
"1111","getmotivated",37,"thanks for all the",11
"1112","getmotivated",35.18,"the size of the",11
"1113","getmotivated",32.45,"no choice but to",11
"1114","getmotivated",32.31,"for me this is",13
"1115","getmotivated",31.33,"know what to say",12
"1116","getmotivated",31,"what you should do",11
"1117","getmotivated",30.85,"this is /r/getmotivated not",13
"1118","getmotivated",30.09,"for quite a while",11
"1119","getmotivated",28.85,"kind of person who",13
"1120","getmotivated",27.92,"he can do it",12
"1121","gif",23.12,"| 3^mos | gifs",17
"1122","gif",21.27,"| 2^mos | gifs",15
"1123","gif",20.58,"| 7^mos | gifs",19
"1124","gif",20.5,"| 7^mos | funny",12
"1125","gif",20.38,"this is why you",13
"1126","gif",17.92,"pretty sure this is",13
"1127","gif",17.91,"he was going to",11
"1128","gif",17.25,"i don't know how",16
"1129","gif",16.81,"| 8^mos | gifs",16
"1130","gif",16.75,"time i see this",16
"1131","gifs",100,"edit: thank you for",11
"1132","gifs",83.69,"thanks for the gold",29
"1133","gifs",65.18,"glory to the hypnotoad",11
"1134","gifs",64.68,"edit: thanks for the",22
"1135","gifs",62.33,"to make the gif",12
"1136","gifs",56.92,"it turns out that",12
"1137","gifs",53.88,"hell is going on",17
"1138","gifs",53.06,"the hell is going",16
"1139","gifs",49.91,"the time he was",11
"1140","gifs",49.73,"that doesn't sound right",11
"1141","globaloffensive",53.27,"anymore this is real",11
"1142","globaloffensive",42.09,"this is real life",11
"1143","globaloffensive",33.82,"in the history of",17
"1144","globaloffensive",33.5,"seen in a long",12
"1145","globaloffensive",32.91,"one hell of a",11
"1146","globaloffensive",31.46,"best player in the",13
"1147","globaloffensive",30.75,"are you kidding me",28
"1148","globaloffensive",30.55,"oh baby a triple",11
"1149","globaloffensive",30.14,"i've seen in a",22
"1150","globaloffensive",29.43,"the game because of",14
"1151","grandtheftautov",44.82,"santos and blaine county",11
"1152","grandtheftautov",41.25,"los santos and blaine",12
"1153","grandtheftautov",39.36,"grand theft auto online",28
"1154","grandtheftautov",39,"time i switched to",12
"1155","grandtheftautov",37.57,"to grand theft auto",14
"1156","grandtheftautov",37.55,"i can't believe how",11
"1157","grandtheftautov",36.14,"beep beep beep beep",21
"1158","grandtheftautov",34.67,"is the fact that",18
"1159","grandtheftautov",34.36,"in the form of",11
"1160","grandtheftautov",34.29,"in red dead redemption",14
"1161","guildwars2",45.5,"have been added to",12
"1162","guildwars2",43.35,"you\u2019ll be able to",23
"1163","guildwars2",39.18,"fixed a bug with",11
"1164","guildwars2",38.75,"the game during the",12
"1165","guildwars2",37.45,"we would like to",11
"1166","guildwars2",36.46,"guild wars 2 that",13
"1167","guildwars2",36.12,"been added to the",17
"1168","guildwars2",36.09,"all the new players",11
"1169","guildwars2",35.43,"caught up in the",14
"1170","guildwars2",35.36,"fixed a bug where",11
"1171","guitar",34.67,"hills and far away",18
"1172","guitar",32.7,"over the hills and",20
"1173","guitar",32.7,"the hills and far",20
"1174","guitar",31,"what do you call",21
"1175","guitar",30.11,"screw in a lightbulb",18
"1176","guitar",29.21,"it take to screw",19
"1177","guitar",29.21,"take to screw in",19
"1178","guitar",29.21,"to screw in a",19
"1179","guitar",27.36,"to change a lightbulb",11
"1180","guitar",25.94,"smells like teen spirit",18
"1181","guns",38.47,"you have to ask",17
"1182","guns",33.62,"rest of the country",13
"1183","guns",33.55,"like to think of",11
"1184","guns",32.83,"i got pulled over",12
"1185","guns",31.91,"the history of the",11
"1186","guns",31.18,"now i feel like",11
"1187","guns",30.73,"for those of you",15
"1188","guns",29.17,"it was a very",12
"1189","guns",29.07,"be sure of your",14
"1190","guns",28.8,"as you can see",15
"1191","harrypotter",49.75,"of magical law enforcement",12
"1192","harrypotter",49.05,"the three of them",19
"1193","harrypotter",45.57,"father will hear about",14
"1194","harrypotter",43.77,"and the chamber of",13
"1195","harrypotter",42.92,"of the most powerful",12
"1196","harrypotter",39.91,"i think it's pretty",11
"1197","harrypotter",38.27,"at all in the",11
"1198","harrypotter",37.69,"and the goblet of",16
"1199","harrypotter",36.77,"potter and the goblet",13
"1200","harrypotter",36.45,"potter and the chamber",11
"1201","health",24.64,"this article is a",11
"1202","health",15.09,"has been around for",11
"1203","health",14.91,"it in a way",11
"1204","health",14.75,"do it in a",12
"1205","health",14.36,"turn out to be",11
"1206","health",13.62,"to think that the",13
"1207","health",11.85,"if you live in",13
"1208","health",11.65,"to the er for",17
"1209","health",11.55,"but i think it",11
"1210","health",11.42,"and if you don't",12
"1211","hearthstone",68.14,"you're thinking of the",14
"1212","hearthstone",64.58,"\u2611 ""he had the",12
"1213","hearthstone",64.58,"is crazy\u201d \u2611 \u201cmy",12
"1214","hearthstone",64.58,"like that\u201d \u2611 ""he",12
"1215","hearthstone",64.58,"that\u201d \u2611 ""he needed",12
"1216","hearthstone",61.85,"\u2611 \u201cthere was nothing",13
"1217","hearthstone",61.15,"""he had the perfect",13
"1218","hearthstone",61.15,"\u201cthere was nothing i",13
"1219","hearthstone",60.09,"thinking of the guy",11
"1220","hearthstone",59,"that could beat me\u201d",11
"1221","hiphopheads",96.46,"keef makes music for",24
"1222","hiphopheads",95.75,"chief keef makes music",20
"1223","hiphopheads",92.82,"music for niggas that",39
"1224","hiphopheads",92.69,"drake makes music for",13
"1225","hiphopheads",87.82,"makes music for niggas",93
"1226","hiphopheads",85.81,"music for niggas who",93
"1227","hiphopheads",83.91,"make music for niggas",46
"1228","hiphopheads",59.36,"like the type of",11
"1229","hiphopheads",58.67,"so that he could",12
"1230","hiphopheads",57.87,"in the same room",15
"1231","history",35,"and was one of",11
"1232","history",33.71,"be able to get",14
"1233","history",28.25,"if you had to",12
"1234","history",27.75,"during the battle of",28
"1235","history",27.14,"in the ancient world",14
"1236","history",26.5,"as a result the",12
"1237","history",26.33,"for a variety of",15
"1238","history",25.91,"the german invasion of",11
"1239","history",25.55,"we think of as",11
"1240","history",25.45,"what we think of",11
"1241","historyporn",54.18,"i feel like there",11
"1242","historyporn",45.33,"and here is the",12
"1243","historyporn",44,"it was meant to",11
"1244","historyporn",43.45,"at the edge of",11
"1245","historyporn",40.73,"standing in front of",11
"1246","historyporn",40.64,"this is from the",11
"1247","historyporn",39.73,"at the corner of",11
"1248","historyporn",37.8,"to make sure that",15
"1249","historyporn",37,"i will never forget",11
"1250","historyporn",37,"the day of the",12
"1251","hockey",85.32,"thanks for the gold",19
"1252","hockey",70.4,"edit: thanks for the",15
"1253","hockey",54.27,"eliminated from the playoffs",15
"1254","hockey",51.78,"this will be the",18
"1255","hockey",49.85,"welcome to the club",13
"1256","hockey",48.77,"us one of us",22
"1257","hockey",48.67,"those who don't know",12
"1258","hockey",48.27,"and do you have",11
"1259","hockey",48,"one of us one",23
"1260","hockey",47.25,"of us one of",24
"1261","holdmybeer",30.64,"edge of the pool",11
"1262","holdmybeer",29,"the best possible outcome",11
"1263","holdmybeer",27.78,"reminds me of this",18
"1264","holdmybeer",27.14,"i love how the",21
"1265","holdmybeer",25.24,"thing i've ever seen",17
"1266","holdmybeer",25.21,"things are heavy as",19
"1267","holdmybeer",24.86,"i love how he",21
"1268","holdmybeer",24.82,"because that's how you",11
"1269","holdmybeer",24.59,"every time i see",17
"1270","holdmybeer",24.47,"those things are heavy",17
"1271","homebrewing",17.91,"i had a friend",11
"1272","homebrewing",16.55,"you might have a",11
"1273","homebrewing",16.18,"a bit too much",11
"1274","homebrewing",15.42,"feel the same way",12
"1275","homebrewing",14.67,"- boil 600 min",12
"1276","homebrewing",14.45,"that this is a",11
"1277","homebrewing",14.41,"about a year ago",17
"1278","homebrewing",14.31,"% - boil 600",13
"1279","homebrewing",13.88,"please let me know",16
"1280","homebrewing",13.85,"leave it in the",13
"1281","howto",20.95,"if you live in",19
"1282","howto",18.55,"teach them how to",11
"1283","howto",18.27,"you may be able",11
"1284","howto",17.93,"the problem is that",15
"1285","howto",16.18,"a picture of a",11
"1286","howto",15.42,"i feel like i'm",12
"1287","howto",14,"a lot easier to",11
"1288","howto",14,"you want to be",20
"1289","howto",13.75,"is one of those",12
"1290","howto",12.77,"you want to get",13
"1291","howtonotgiveafuck",31.14,"no matter what you",14
"1292","howtonotgiveafuck",28.09,"going out of your",11
"1293","howtonotgiveafuck",25.36,"the balls to do",14
"1294","howtonotgiveafuck",24.91,"know what you are",11
"1295","howtonotgiveafuck",24.85,"only thing you can",13
"1296","howtonotgiveafuck",24.77,"about what you think",13
"1297","howtonotgiveafuck",24.73,"you need to know",11
"1298","howtonotgiveafuck",23.31,"don't think this is",13
"1299","howtonotgiveafuck",23.31,"have the balls to",13
"1300","howtonotgiveafuck",22.75,"who you are you",12
"1301","humanporn",23.64,"i don't think i've",11
"1302","humanporn",23.55,"you can see that",11
"1303","humanporn",21.29,"a picture like this",14
"1304","humanporn",19.57,"it was taken in",14
"1305","humanporn",19.29,"you are going to",14
"1306","humanporn",17.83,"i think it is",18
"1307","humanporn",17.83,"what the fuck is",12
"1308","humanporn",17.55,"the shit out of",11
"1309","humanporn",17.27,"i want to go",11
"1310","humanporn",16.88,"i can't help but",16
"1311","humor",42.42,"i like my women",12
"1312","humor",42.42,"like i like my",12
"1313","humor",42.42,"like my women like",12
"1314","humor",42.42,"my women like i",12
"1315","humor",42.42,"women like i like",12
"1316","humor",38.64,"has a sense of",11
"1317","humor",35.87,"do something like this",15
"1318","humor",29.69,"this was the onion",13
"1319","humor",28.21,"a little too close",14
"1320","humor",28.21,"little too close to",14
"1321","iama",100,"a new kind of",11
"1322","iama",100,"for the gold stranger",11
"1323","iama",100,"in the face and",11
"1324","iama",100,"line is it anyway",13
"1325","iama",100,"my highest rated comment",14
"1326","iama",100,"the price is right",13
"1327","iama",100,"whose line is it",16
"1328","iama",100,"would come in and",12
"1329","iama",99.77,"i loved working with",13
"1330","iama",99.5,"you for the gold",24
"1331","idiotsfightingthings",27.13,"my favorite part is",16
"1332","idiotsfightingthings",26.88,"i like to think",16
"1333","idiotsfightingthings",25.25,"idiots fighting things and",12
"1334","idiotsfightingthings",24.18,"go to the hospital",11
"1335","idiotsfightingthings",23.67,"i love how he",30
"1336","idiotsfightingthings",23.65,"an idiot fighting something",17
"1337","idiotsfightingthings",21.82,"this guy is an",11
"1338","idiotsfightingthings",21.39,"out of the way",18
"1339","idiotsfightingthings",21.36,"looks to me like",11
"1340","idiotsfightingthings",21.33,"an idiot fighting a",24
"1341","interestingasfuck",40,"i have to say",11
"1342","interestingasfuck",36.14,"there once was a",14
"1343","interestingasfuck",34.5,"as soon as the",14
"1344","interestingasfuck",33.73,"the size of jupiter",11
"1345","interestingasfuck",30.73,"like some kind of",11
"1346","interestingasfuck",29.43,"to the rest of",14
"1347","interestingasfuck",29.13,"don't get me wrong",16
"1348","interestingasfuck",28.73,"on the edge of",11
"1349","interestingasfuck",28.17,"as someone who is",12
"1350","interestingasfuck",27,"the way to the",13
"1351","internetisbeautiful",34.52,"is a screenshot of",50
"1352","internetisbeautiful",33.94,"please feel free to",50
"1353","internetisbeautiful",33.77,"hello i'm a bot",48
"1354","internetisbeautiful",33.77,"here is a screenshot",48
"1355","internetisbeautiful",33.77,"i'm a bot who",48
"1356","internetisbeautiful",33.77,"on reddit here is",48
"1357","internetisbeautiful",33.77,"pm me your comments/suggestions/hatemail",48
"1358","internetisbeautiful",33.77,"posted on reddit here",48
"1359","internetisbeautiful",33.77,"reddit here is a",48
"1360","internetisbeautiful",33.77,"screenshot of the website",48
"1361","investing",27.33,"in order to have",12
"1362","investing",26.58,"do the opposite of",12
"1363","investing",24.17,"actively managed mutual funds",12
"1364","investing",23.85,"into a roth ira",13
"1365","investing",23.79,"the velocity of money",14
"1366","investing",20.13,"this is actually a",15
"1367","investing",19.91,"which is going to",11
"1368","investing",19.77,"figure out how much",13
"1369","investing",19.55,"what not to do",11
"1370","investing",19.45,"bogleheads' guide to investing",11
"1371","iphone",31.42,"it off and on",12
"1372","iphone",27.27,"from left to right",11
"1373","iphone",26.69,"put it in rice",16
"1374","iphone",25.92,"i have to agree",13
"1375","iphone",25.17,"in the iphone 5",12
"1376","iphone",24.44,"turning it off and",18
"1377","iphone",24.43,"press the home button",14
"1378","iphone",24,"apple is going to",20
"1379","iphone",23.95,"a bag of rice",19
"1380","iphone",23.38,"defeats the purpose of",16
"1381","itookapicture",24,"he looks like a",11
"1382","itookapicture",21.24,"i like the picture",17
"1383","itookapicture",16.55,"i have to say",20
"1384","itookapicture",16.42,"just wanted to say",12
"1385","itookapicture",16.25,"out of the frame",12
"1386","itookapicture",16.09,"a print of this",11
"1387","itookapicture",15.55,"i love the colors",11
"1388","itookapicture",15.31,"i don't think the",13
"1389","itookapicture",15.27,"as you can see",22
"1390","itookapicture",15.14,"a picture of my",14
"1391","iwanttolearn",37.62,"and when you do",13
"1392","iwanttolearn",31.57,"you want to start",14
"1393","iwanttolearn",30.82,"until you can do",11
"1394","iwanttolearn",30.18,"but you should be",11
"1395","iwanttolearn",28.43,"and i'm going to",14
"1396","iwanttolearn",27.45,"out of it and",11
"1397","iwanttolearn",27.4,"as quickly as possible",15
"1398","iwanttolearn",27.14,"a year ago i",14
"1399","iwanttolearn",27.14,"the idea is that",21
"1400","iwanttolearn",26.92,"to do this and",13
"1401","jokes",68.67,"thanks for the gold",12
"1402","jokes",60.75,"once was a woman",16
"1403","jokes",58.15,"in front of him",13
"1404","jokes",58.08,"says to the other",13
"1405","jokes",57.35,"reminds me of another",17
"1406","jokes",56,"a man goes to",12
"1407","jokes",53.92,"me of an old",12
"1408","jokes",47.07,"and says to the",14
"1409","jokes",45.23,"the next day the",31
"1410","jokes",45.09,"about to jump off",11
"1411","justiceporn",57.4,"i felt like i",15
"1412","justiceporn",53.93,"you want to fight",15
"1413","justiceporn",52.36,"has no idea what",14
"1414","justiceporn",50,"they were about to",11
"1415","justiceporn",49.82,"felt like i was",17
"1416","justiceporn",49.73,"one of the nicest",11
"1417","justiceporn",49.47,"punched me in the",15
"1418","justiceporn",48.69,"me in the back",13
"1419","justiceporn",48.18,"in the past and",11
"1420","justiceporn",46.43,"punching him in the",14
"1421","keto",31.54,"if it wasn't for",13
"1422","keto",28.75,"and i had to",12
"1423","keto",24.75,"was the first time",12
"1424","keto",22.08,"now i'm going to",12
"1425","keto",22,"on the right path",11
"1426","keto",21.92,"and you know what",12
"1427","keto",21.63,"has changed my life",16
"1428","keto",21.25,"of bacon and eggs",12
"1429","keto",20.85,"never go back to",13
"1430","keto",20.08,"an hour or so",12
"1431","ladyboners",35.64,"i'm a straight man",11
"1432","ladyboners",29.83,"to be one of",12
"1433","ladyboners",27.06,"i'm going to go",17
"1434","ladyboners",26.17,"i think we need",12
"1435","ladyboners",26,"in my panties right",12
"1436","ladyboners",25.91,"he just looks like",11
"1437","ladyboners",24.86,"that i want to",14
"1438","ladyboners",24.08,"the front page of",13
"1439","ladyboners",23.63,"the rest of us",16
"1440","ladyboners",23.46,"i feel like i'm",13
"1441","leagueoflegends",80.93,"leave above link unaltered",14
"1442","leagueoflegends",79.46,"---- ^mistake http://wwwredditcom/message/compose/to=tweetposter subject=error%20report",13
"1443","leagueoflegends",79.46,"^code https://githubcom/buttscicles/tweetposter ^issues https://githubcom/buttscicles/tweetposter/issues",13
"1444","leagueoflegends",79.46,"^suggestion http://wwwredditcom/message/compose/to=tweetposter subject=suggestion ^faq",13
"1445","leagueoflegends",79.46,"above link unaltered ^suggestion",13
"1446","leagueoflegends",79.46,"link unaltered ^suggestion http://wwwredditcom/message/compose/to=tweetposter",13
"1447","leagueoflegends",79.46,"unaltered ^suggestion http://wwwredditcom/message/compose/to=tweetposter subject=suggestion",13
"1448","leagueoflegends",75,"a^2 + b^2 =",11
"1449","leagueoflegends",71.07,"the benefit of the",14
"1450","leagueoflegends",70.62,"professional league of legends",13
"1451","learnprogramming",28.6,"a version control system",15
"1452","learnprogramming",26.64,"at a higher level",11
"1453","learnprogramming",26.25,"of the time the",20
"1454","learnprogramming",25.18,"allow you to do",17
"1455","learnprogramming",24.76,"one or the other",17
"1456","learnprogramming",24.33,"on the type of",12
"1457","learnprogramming",24.23,"i'd like to point",13
"1458","learnprogramming",23.28,"of what you are",18
"1459","learnprogramming",23.13,"to build your own",16
"1460","learnprogramming",23.09,"this is the kind",11
"1461","learnuselesstalents",33.45,"you know what i",11
"1462","learnuselesstalents",30.55,"this is probably the",11
"1463","learnuselesstalents",28.85,"on the side of",13
"1464","learnuselesstalents",26.45,"how do i make",11
"1465","learnuselesstalents",25.92,"is far from useless",12
"1466","learnuselesstalents",25.73,"not sure if this",11
"1467","learnuselesstalents",25.5,"be one of the",12
"1468","learnuselesstalents",25.11,"for the rest of",18
"1469","learnuselesstalents",25.08,"truly a useless talent",13
"1470","learnuselesstalents",24.85,"to go to the",13
"1471","libertarian",32.5,"is peace freedom is",14
"1472","libertarian",32.5,"peace freedom is slavery",14
"1473","libertarian",32.5,"war is peace freedom",14
"1474","libertarian",32.23,"to make an example",13
"1475","libertarian",31.21,"a higher minimum wage",14
"1476","libertarian",30.36,"bigger fish to fry",14
"1477","libertarian",30.27,"to keep us safe",15
"1478","libertarian",29.67,"the minimum wage to",12
"1479","libertarian",26.82,"16 year old son",11
"1480","libertarian",26.73,"the fast and furious",11
"1481","lifehacks",31.75,"thing i've ever seen",12
"1482","lifehacks",29.18,"i like how the",11
"1483","lifehacks",28.55,"there will be a",11
"1484","lifehacks",27.31,"you want to keep",13
"1485","lifehacks",26.25,"if you need a",12
"1486","lifehacks",25.09,"tell you how many",11
"1487","lifehacks",24.75,"but it looks like",12
"1488","lifehacks",24.36,"and put it back",11
"1489","lifehacks",24.2,"will be able to",15
"1490","lifehacks",23.91,"a hole in your",11
"1491","lifeprotips",70.36,"thanks for the gold",11
"1492","lifeprotips",53,"on the part of",11
"1493","lifeprotips",51.31,"off with a warning",16
"1494","lifeprotips",50,"should be noted that",11
"1495","lifeprotips",47.73,"a lot to me",11
"1496","lifeprotips",46.75,"edit: thanks for the",12
"1497","lifeprotips",45.57,"of the car and",14
"1498","lifeprotips",44.47,"ask them if they",15
"1499","lifeprotips",44.25,"not the other way",12
"1500","lifeprotips",44.18,"this seems to be",17
"1501","linux",42.09,"of the linux community",11
"1502","linux",39.64,"under the guise of",14
"1503","linux",37.91,"that we have to",11
"1504","linux",37.25,"some of which are",12
"1505","linux",35.58,"many of the people",12
"1506","linux",33.27,"this incident will be",11
"1507","linux",33.27,"will be the year",11
"1508","linux",32.29,"you want me to",14
"1509","linux",32.25,"i really wish i",12
"1510","linux",32.09,"a very good thing",11
"1511","listentothis",36,"the mother we share",11
"1512","listentothis",26.67,"i feel like it",12
"1513","listentothis",21.25,"and so i watch",12
"1514","listentothis",21,"watch you from afar",12
"1515","listentothis",19.73,"hell of a lot",11
"1516","listentothis",19.14,"i watch you from",14
"1517","listentothis",19.14,"so i watch you",14
"1518","listentothis",18.82,"punk - get lucky",11
"1519","listentothis",18.43,"are some of my",14
"1520","listentothis",17.55,"is the kind of",11
"1521","loseit",33.77,"might as well be",13
"1522","loseit",33.06,"was going to die",17
"1523","loseit",31.73,"to talk to me",11
"1524","loseit",31.23,"makes you feel like",13
"1525","loseit",31.07,"thank you all for",14
"1526","loseit",30.27,"how fat i was",11
"1527","loseit",29,"look ten years younger",11
"1528","loseit",28.82,"i was a fat",11
"1529","loseit",28.73,"i was tired of",15
"1530","loseit",28.54,"to tell you how",13
"1531","luciddreaming",25,"so that i could",12
"1532","luciddreaming",22.55,"at the time of",11
"1533","luciddreaming",20.72,"i woke up the",18
"1534","luciddreaming",20.67,"and i realized that",15
"1535","luciddreaming",19.91,"opened my eyes i",11
"1536","luciddreaming",18.83,"and i started to",12
"1537","luciddreaming",18.13,"i was taking a",15
"1538","luciddreaming",18.08,"me that i was",12
"1539","luciddreaming",17.92,"in an attempt to",13
"1540","luciddreaming",17.33,"a part of your",24
"1541","magictcg",37,"creatures you control gain",11
"1542","magictcg",36.7,"you have two cows",27
"1543","magictcg",34.46,"that weak shit off",13
"1544","magictcg",34.17,"add one mana of",12
"1545","magictcg",32.14,"weak shit off my",14
"1546","magictcg",31.77,"one mana of any",13
"1547","magictcg",31.46,"huntmaster of the fells",13
"1548","magictcg",31.42,"i can't wait until",12
"1549","magictcg",31.17,"any color to your",12
"1550","magictcg",30.27,"lack of a better",11
"1551","makeupaddiction",63.75,"mac paint pot in",12
"1552","makeupaddiction",53.91,"nyx jumbo pencil in",11
"1553","makeupaddiction",52.85,"maybelline fit me foundation",13
"1554","makeupaddiction",52.5,"fit me foundation in",12
"1555","makeupaddiction",50.57,"thank you all for",14
"1556","makeupaddiction",47.33,"jumbo pencil in milk",12
"1557","makeupaddiction",46.82,"that i used to",11
"1558","makeupaddiction",44.53,"mac pro longwear concealer",17
"1559","makeupaddiction",42.75,"too faced shadow insurance",20
"1560","makeupaddiction",42.17,"eye pencil in milk",18
"1561","malefashionadvice",66.18,"for users new to",17
"1562","malefashionadvice",66.18,"for what are you",17
"1563","malefashionadvice",66.18,"is waywt waywt stands",17
"1564","malefashionadvice",66.18,"new to mfa: welcome",17
"1565","malefashionadvice",66.18,"people are genuinely curious",17
"1566","malefashionadvice",66.18,"stands for what are",17
"1567","malefashionadvice",66.18,"users new to mfa:",17
"1568","malefashionadvice",66.18,"waywt stands for what",17
"1569","malefashionadvice",66.18,"waywt waywt stands for",17
"1570","malefashionadvice",66.18,"what is waywt waywt",17
"1571","mapporn",59.09,"edit: thanks for the",11
"1572","mapporn",43.15,"is beating his wife",13
"1573","mapporn",38.92,"if it makes you",13
"1574","mapporn",38.75,"devil is beating his",16
"1575","mapporn",38.36,"the sun never sets",11
"1576","mapporn",37.27,"saint pierre and miquelon",11
"1577","mapporn",36.92,"as an australian i",13
"1578","mapporn",36.55,"i was waiting for",11
"1579","mapporn",36,"a huge impact on",11
"1580","mapporn",35.89,"the district of columbia",18
"1581","math",41.15,"orders a beer the",13
"1582","math",40.92,"math should be taught",12
"1583","math",40.33,"a bar the first",18
"1584","math",38.76,"into a bar the",21
"1585","math",38.71,"a beer the second",14
"1586","math",37.89,"walk into a bar",27
"1587","math",35.5,"mathematicians walk into a",18
"1588","math",33.54,"number of mathematicians walk",13
"1589","math",32.93,"and a mathematician are",15
"1590","math",32.33,"engineer a physicist and",12
"1591","meditation",27,"to get you to",12
"1592","meditation",22.82,"to do this is",11
