"","subreddit","score","ngram","occurrences"
"1","4chan",74.42,"i will probably feel",12
"2","4chan",74.42,"will probably feel joy",12
"3","4chan",71.5,"and i will probably",14
"4","4chan",71.5,"believe that i have",14
"5","4chan",70.92,"smart enough to use",13
"6","4chan",70.07,"am smart enough to",15
"7","4chan",69.92,"enough to use a",13
"8","4chan",69.63,"was raised to do",16
"9","4chan",69.63,"what i was raised",16
"10","4chan",69.31,"threat believe that i",13
"11","abandonedporn",43.82,"here are some more",11
"12","abandonedporn",36.58,"can be found here",12
"13","abandonedporn",35.42,"now it's a ghost",12
"14","abandonedporn",30.5,"it's a ghost town",14
"15","abandonedporn",29.91,"used to live here",11
"16","abandonedporn",29.82,"a video of the",11
"17","abandonedporn",28.67,"people used to live",27
"18","abandonedporn",28.17,"i like to imagine",12
"19","abandonedporn",27.92,"and it was the",12
"20","abandonedporn",27.23,"for a while and",13
"21","adventuretime",48.27,"be here tomorrow to",11
"22","adventuretime",48.27,"still be here tomorrow",11
"23","adventuretime",47.36,"sweetness can win and",11
"24","adventuretime",46,"bursting decadence and withheld",12
"25","adventuretime",46,"of bursting decadence and",12
"26","adventuretime",45,"and withheld permissions twists",11
"27","adventuretime",45,"permissions twists all our",11
"28","adventuretime",45,"withheld permissions twists all",11
"29","adventuretime",44.42,"can win and it",12
"30","adventuretime",44.42,"i'll still be here",12
"31","adviceanimals",97.95,"^^cations ^^aren't ^^guaranteed ^^to",39
"32","adviceanimals",97.95,"^^these ^^cations ^^aren't ^^guaranteed",39
"33","adviceanimals",80.03,"edit: thanks for the",31
"34","adviceanimals",78.86,"thanks for the gold",44
"35","adviceanimals",71.67,"for the gold kind",12
"36","adviceanimals",66.58,"i wrote a song",12
"37","adviceanimals",64.86,"^^aren't ^^guaranteed ^^to ^^be",110
"38","adviceanimals",64.86,"^^guaranteed ^^to ^^be ^^correct",110
"39","adviceanimals",62.58,"you feel like a",12
"40","adviceanimals",62.5,"you for the gold",16
"41","alienblue",46.86,"the new icon is",14
"42","alienblue",43.18,"so that you can",11
"43","alienblue",36.33,"which is why i",15
"44","alienblue",35.92,"the top bar to",12
"45","alienblue",33.23,"one of the few",13
"46","alienblue",30.36,"to the pro version",11
"47","alienblue",27.77,"in the last couple",13
"48","alienblue",27.09,"love this app so",11
"49","alienblue",26.73,"the last couple of",15
"50","alienblue",26.42,"alien blue for iphone",12
"51","android",79.55,"thanks for the gold",11
"52","android",47.64,"trying to do something",11
"53","android",44.5,"the next generation of",12
"54","android",43.08,"who am i kidding",13
"55","android",41.33,"better than any other",15
"56","android",41.18,"capacity of the battery",11
"57","android",41.15,"eat my own dick",13
"58","android",40.82,"will be available for",11
"59","android",40.69,"from an iphone to",16
"60","android",39.64,"to allow people to",11
"61","animalsbeingjerks",42.42,"i love the way",12
"62","animalsbeingjerks",39.75,"the look on the",16
"63","animalsbeingjerks",36.64,"it looks like he's",11
"64","animalsbeingjerks",36.45,"what he was doing",11
"65","animalsbeingjerks",34.64,"i love the look",11
"66","animalsbeingjerks",34.62,"being a jerk he's",13
"67","animalsbeingjerks",32.73,"love how the cat",11
"68","animalsbeingjerks",32.44,"how can she slap",16
"69","animalsbeingjerks",32.1,"i like how he",21
"70","animalsbeingjerks",31.91,"this is probably the",11
"71","anime",46.23,"am the bone of",13
"72","anime",45.85,"can't be this cute",13
"73","anime",43.25,"hell of a ride",12
"74","anime",42.38,"where this is going",13
"75","anime",41.75,"for those of you",12
"76","anime",41.75,"i am the bone",12
"77","anime",41.75,"the bone of my",12
"78","anime",40,"wants to be a",12
"79","anime",39.91,"in the next episode",11
"80","anime",39.82,"in love with him",11
"81","apple",36.38,"to the crazy ones",13
"82","apple",34.73,"as we know it",11
"83","apple",31.91,"thanks for the gold",11
"84","apple",31,"at my local apple",12
"85","apple",30,"way back to the",11
"86","apple",29.85,"steve jobs would have",13
"87","apple",29.77,"i think you meant",13
"88","apple",29.27,"was blown away by",11
"89","apple",29.08,"i worked as a",13
"90","apple",28.87,"it's nice to see",15
"91","arresteddevelopment",53.83,"the story of a",12
"92","arresteddevelopment",42.78,"fun sexy time for",18
"93","arresteddevelopment",42.78,"what a fun sexy",18
"94","arresteddevelopment",41.87,"no part of your",15
"95","arresteddevelopment",41.17,"no choice but to",12
"96","arresteddevelopment",40.63,"a fun sexy time",19
"97","arresteddevelopment",39.17,"they make him look",12
"98","arresteddevelopment",39.11,"want no part of",19
"99","arresteddevelopment",38,"telling your mother about",11
"100","arresteddevelopment",37.38,"make him look like",13
"101","art",26.5,"lot of people are",12
"102","art",25.18,"more of his work",11
"103","art",23,"you would like to",13
"104","art",22.75,"of all of the",12
"105","art",22.36,"i don't give a",14
"106","art",20.73,"a couple years ago",11
"107","art",19.27,"just looks like a",11
"108","art",19.24,"the fuck out of",17
"109","art",17.63,"don't want to be",16
"110","art",17.08,"it may be a",12
"111","askhistorians",86.73,"thanks for the gold",11
"112","askhistorians",62.54,"in the holy land",13
"113","askhistorians",62.33,"the presence of the",15
"114","askhistorians",60.8,"i'll do my best",20
"115","askhistorians",60.64,"had access to a",11
"116","askhistorians",59.62,"however one of the",13
"117","askhistorians",59.58,"ignores the fact that",12
"118","askhistorians",59.56,"the women and children",18
"119","askhistorians",58.64,"we are looking for",11
"120","askhistorians",58.43,"the north korean government",14
"121","askmen",83.68,"thanks for the gold",34
"122","askmen",73.77,"edit: thanks for the",31
"123","askmen",61.15,"afraid to talk to",13
"124","askmen",58.09,"thought it was hilarious",11
"125","askmen",56.45,"hit in the balls",11
"126","askmen",53.47,"and she tells me",15
"127","askmen",53.09,"first time i've ever",11
"128","askmen",52.91,"feel like the most",11
"129","askmen",52.77,"not attracted to you",13
"130","askmen",52.64,"and that you can",11
"131","askreddit",100,"yes i know i",12
"132","askreddit",100,"you all for the",23
"133","askreddit",100,"you do not have",14
"134","askreddit",100,"you for all the",21
"135","askreddit",100,"you for my first",12
"136","askreddit",100,"you for the reddit",16
"137","askreddit",100,"you get a good",11
"138","askreddit",100,"you kind stranger for",19
"139","askreddit",100,"you know you are",13
"140","askreddit",100,"you that you have",11
"141","askscience",89.41,"thanks for the gold",29
"142","askscience",67.12,"edit: thanks for the",33
"143","askscience",64.67,"people have pointed out",18
"144","askscience",55.64,"same way as a",11
"145","askscience",53.36,"the great red spot",14
"146","askscience",52.33,"are a bit more",12
"147","askscience",50.55,"frame in which the",11
"148","askscience",50.46,"together to make a",13
"149","askscience",50.33,"or all of the",12
"150","askscience",49.67,"this is where it",12
"151","askwomen",89.83,"thanks for the gold",18
"152","askwomen",74.38,"edit: thanks for the",16
"153","askwomen",70.55,"""you look like a",11
"154","askwomen",55.67,"the middle of sex",12
"155","askwomen",55,"on her period and",11
"156","askwomen",53.45,"in the sink and",11
"157","askwomen",53.07,"not like other girls""",15
"158","askwomen",52.82,"i love when a",11
"159","askwomen",52.27,"i couldn't stop laughing",11
"160","askwomen",52.09,"with this guy who",11
"161","asoiaf",75.36,"you would do well",14
"162","asoiaf",70.13,"would do well to",16
"163","asoiaf",70,"old this will be",11
"164","asoiaf",69.94,"with the taste of",17
"165","asoiaf",65.69,"hair ned loves my",13
"166","asoiaf",65.48,"me rue the day",21
"167","asoiaf",65.48,"rue the day i",21
"168","asoiaf",65.45,"is almost upon us",11
"169","asoiaf",65.18,"want to lick it",11
"170","asoiaf",65.18,"when my axe bites",11
"171","astronomy",29.5,"img_source=sky-map powered by astrometrynet",24
"172","astronomy",29.5,"show_const_names=1 show_galaxies=1 img_source=sky-map powered",24
"173","astronomy",29.5,"show_galaxies=1 img_source=sky-map powered by",24
"174","astronomy",28.52,"| nbsp;^1 tags may",25
"175","astronomy",28.52,"automatically generated comment coordinates",25
"176","astronomy",28.52,"generated comment coordinates http://enwikipediaorg/wiki/celestial_coordinate_system:",25
"177","astronomy",28.52,"nbsp;^1 tags may overlap",25
"178","astronomy",28.47,"feedback http://wwwredditcom/message/composeto=%23astro-bot | nbsp;^1",15
"179","astronomy",28.47,"http://wwwredditcom/message/composeto=%23astro-bot | nbsp;^1 tags",15
"180","astronomy",28.38,"| feedback http://wwwredditcom/message/composeto=%23astro-bot |",16
"181","atheism",59.88,"thanks for the gold",26
"182","atheism",59.15,"edit: thanks for the",20
"183","atheism",55,"that most of these",11
"184","atheism",54.23,"i think you just",13
"185","atheism",53.25,"you're telling me that",12
"186","atheism",49.82,"grown up in a",11
"187","atheism",49.23,"door and pray to",13
"188","atheism",49.23,"pray go into your",13
"189","atheism",49.23,"pray to your father",13
"190","atheism",49.23,"you pray go into",13
"191","aww",79.25,"thanks for the gold",24
"192","aww",71.18,"drawing of your comment",11
"193","aww",68.87,"edit: thanks for the",15
"194","aww",66,"a drawing of your",12
"195","aww",58.55,"thank you kind stranger",11
"196","aww",58.13,"i had a pet",15
"197","aww",50.77,"the dog and the",13
"198","aww",49,"i love that the",11
"199","aww",48.12,"by the time i",17
"200","aww",47.94,"you want them to",16
"201","baconreader",9.91,"of the about screen",11
"202","baconreader",9.91,"out of the about",11
"203","baconreader",9.15,"3-4 times on the",13
"204","baconreader",9.15,"long press 3-4 times",13
"205","baconreader",9.15,"press 3-4 times on",13
"206","baconreader",9.15,"times on the version",13
"207","baconreader",8.43,"back out of the",14
"208","baconreader",8.36,"you will see a",11
"209","baconreader",7.67,"the about screen and",15
"210","baconreader",7.13,"get added to the",15
"211","baseball",73.45,"thanks for the gold",11
"212","baseball",69.45,"be romantic about baseball",11
"213","baseball",61.45,"the gif of destiny",38
"214","baseball",51.94,"not be romantic about",18
"215","baseball",51.94,"you not be romantic",18
"216","baseball",51.18,"to catch a knuckleball",11
"217","baseball",49.74,"can you not be",19
"218","baseball",48.45,"no matter what happens",11
"219","baseball",47.79,"if i told you",14
"220","baseball",47.08,"this is the one",13
"221","batman",37.46,"cared who i was",13
"222","batman",37.18,"used to be a",11
"223","batman",37.17,"i was until i",12
"224","batman",37.17,"who i was until",12
"225","batman",33.55,"hand to hand combat",11
"226","batman",31.97,"bruce wayne is the",30
"227","batman",31.82,"this is exactly what",11
"228","batman",31.2,"wayne is the mask",15
"229","batman",29.31,"legends of the dark",13
"230","batman",27.91,"by then it was",11
"231","battlestations",29.93,"asus rampage iv extreme",15
"232","battlestations",24.54,"can tell you that",13
"233","battlestations",21.91,"@ ncix us storage",11
"234","battlestations",21.91,"ncix us storage |",11
"235","battlestations",20.67,"my first thought was",12
"236","battlestations",20.14,"samsung 840 pro series",14
"237","battlestations",19.36,"case | fractal design",11
"238","battlestations",19.33,"have to be a",15
"239","battlestations",18.85,"feel free to ask",20
"240","battlestations",18.73,"what looks like a",11
"241","beer",33.56,"sam adams cherry wheat",18
"242","beer",33.24,"a beer snob and",17
"243","beer",25.86,"i love beer and",14
"244","beer",25.4,"people who don't drink",15
"245","beer",23.86,"this makes me want",14
"246","beer",23.68,"is that there are",19
"247","beer",23.55,"beer as much as",11
"248","beer",22.38,"of the beer is",13
"249","beer",22.33,"you have a problem",15
"250","beer",22.07,"have a place in",15
"251","behindthegifs",33.17,"the keeper of otto",12
"252","behindthegifs",32.85,"never seen that gif",13
"253","behindthegifs",31.79,"seen that gif before",14
"254","behindthegifs",30.31,"this was going to",13
"255","behindthegifs",27.25,"have no idea what",28
"256","behindthegifs",27.25,"not see that coming",12
"257","behindthegifs",26.87,"this is the most",15
"258","behindthegifs",26.38,"this is why i",24
"259","behindthegifs",26.27,"have no idea how",11
"260","behindthegifs",26.08,"i've seen this gif",12
"261","bestof",80,"we hope you enjoy",18
"262","bestof",76.27,"hope you enjoy your",11
"263","bestof",72.33,"be glad to help",12
"264","bestof",71.67,"feel free to message",12
"265","bestof",71.5,"have a set of",12
"266","bestof",69.82,"have any questions or",11
"267","bestof",67.25,"to check them out",12
"268","bestof",66.52,"thanks for the gold",23
"269","bestof",64.62,"take a moment to",26
"270","bestof",64.31,"please feel free to",13
"271","bicycling",34.54,"on the road not",13
"272","bicycling",32.17,"the bike lane when",12
"273","bicycling",24.5,"to be that guy",14
"274","bicycling",23.79,"out of the car",14
"275","bicycling",23.27,"into the back of",15
"276","bicycling",23.21,"in their right mind",14
"277","bicycling",23,"more than my car",11
"278","bicycling",23,"when there is no",13
"279","bicycling",22.55,"foot on the ground",11
"280","bicycling",22.31,"this was one of",13
"281","bitcoin",58.5,"banned from the internet",14
"282","bitcoin",38.08,"edit: thanks for the",24
"283","bitcoin",33.93,"is the guy who",14
"284","bitcoin",33.22,"the moon \u2517\u00b00\u00b0\u251b ^^^\u25cb",63
"285","bitcoin",33.13,"to the moon \u2517\u00b00\u00b0\u251b",106
"286","bitcoin",32.55,"to transfer the money",11
"287","bitcoin",32.27,"will be used to",15
"288","bitcoin",30.92,"of course there is",12
"289","bitcoin",30.81,"thanks for the gold",31
"290","bitcoin",30.31,"where it is today",13
"291","bodyweightfitness",16.92,"you have to go",12
"292","bodyweightfitness",15.82,"i can do 5",11
"293","bodyweightfitness",15.75,"a year or two",16
"294","bodyweightfitness",15.67,"the point where you",12
"295","bodyweightfitness",15.31,"the bottom of a",16
"296","bodyweightfitness",15.17,"where you can do",12
"297","bodyweightfitness",14.82,"be able to perform",22
"298","bodyweightfitness",14.82,"you would have to",11
"299","bodyweightfitness",14.8,"if you don't know",15
"300","bodyweightfitness",14.58,"the middle of a",12
"301","books",77.95,"thanks for the gold",19
"302","books",71.73,"edit: thanks for the",11
"303","books",61,"stranger by albert camus",12
"304","books",61,"the stranger by albert",12
"305","books",56.92,"the prisoner of azkaban",13
"306","books",55.83,"just don't see it",12
"307","books",54.09,"a 7 year old",11
"308","books",52.67,"just want to know",12
"309","books",52.54,"his dark materials trilogy",13
"310","books",51.27,"my rainbow six story",11
"311","breakingbad",74.08,"made up his mind",13
"312","breakingbad",65.36,"can go fuck yourself",11
"313","breakingbad",64.94,"""sorry for your loss""",17
"314","breakingbad",63.82,"i was good at",11
"315","breakingbad",61.04,"and you can go",26
"316","breakingbad",59.33,"""i watched jane die""",12
"317","breakingbad",58.21,"is asac schrader and",19
"318","breakingbad",56.85,"asac schrader and you",20
"319","breakingbad",56.85,"schrader and you can",20
"320","breakingbad",56,"you can go fuck",27
"321","buildapc",41.09,"| samsung sh-b123l/rsbp blu-ray",11
"322","buildapc",41.09,"drive | samsung sh-b123l/rsbp",11
"323","buildapc",41.09,"samsung sh-b123l/rsbp blu-ray reader",11
"324","buildapc",41.09,"sh-b123l/rsbp blu-ray reader dvd/cd",11
"325","buildapc",38.83,"gskill ripjaws z series",12
"326","buildapc",36,"| intel core i7",12
"327","buildapc",36,"intel core i7 extreme",12
"328","buildapc",35.57,"are a couple of",14
"329","buildapc",35.33,"a lot of questions",12
"330","buildapc",35.17,"of course there are",12
"331","business",26.86,"and the majority of",14
"332","business",26.83,"while i wouldn't say",12
"333","business",24.73,"the best in the",11
"334","business",23.82,"by the government to",11
"335","business",21.4,"as soon as possible",15
"336","business",21.15,"nobody wants to be",13
"337","business",20.83,"cents on the dollar",12
"338","business",20.62,"will take care of",13
"339","business",20.2,"they want to be",15
"340","business",20.13,"if you need a",15
"341","buyitforlife",21.55,"lasted a long time",11
"342","buyitforlife",21.45,"seems to me that",11
"343","buyitforlife",21.44,"- i have a",18
"344","buyitforlife",21.36,"this is why you",11
"345","buyitforlife",21,"are guaranteed for life",15
"346","buyitforlife",20.79,"to hell and back",14
"347","buyitforlife",19.58,"as a wedding gift",19
"348","buyitforlife",19.55,"i've seen a lot",11
"349","buyitforlife",19.09,"in contact with the",11
"350","buyitforlife",18.83,"to last for life",12
"351","canada",46.45,"with us or you're",11
"352","canada",43.54,"of us one of",13
"353","canada",43.54,"one of us one",13
"354","canada",43.54,"us one of us",13
"355","canada",39.38,"day for canada and",16
"356","canada",35.83,"and there will be",12
"357","canada",35.5,"in the left lane",12
"358","canada",35.45,"of the party and",11
"359","canada",34.62,"for canada and therefore",13
"360","canada",34.55,"this is a much",11
"361","carporn",19.75,"i think you mean",12
"362","carporn",19.56,"this is not a",16
"363","carporn",18.09,"have to worry about",11
"364","carporn",17.44,"in a parking lot",16
"365","carporn",17.14,"this is just a",14
"366","carporn",16.58,"the car looks like",12
"367","carporn",16,"the point of a",11
"368","carporn",15.85,"i don't care what",13
"369","carporn",15.46,"there's a lot of",13
"370","carporn",15.4,"car looks like a",15
"371","cars",33.82,"like that on a",11
"372","cars",32.75,"what it's like to",12
"373","cars",32.57,"to sell the car",14
"374","cars",31.25,"to one of the",12
"375","cars",30.75,"as a car guy",12
"376","cars",30.18,"of us one of",11
"377","cars",30.18,"one of us one",11
"378","cars",30.18,"us one of us",11
"379","cars",29.75,"ss gt srt8 duramax",12
"380","cars",29.27,"to buy a used",11
"381","cats",46.36,"home and all they",11
"382","cats",46.36,"human\u2019s loving heart of",11
"383","cats",46.36,"i\u2019d will to the",11
"384","cats",46.36,"in my human\u2019s loving",11
"385","cats",46.36,"my human\u2019s loving heart",11
"386","cats",46.36,"my name i\u2019d will",11
"387","cats",46.36,"name i\u2019d will to",11
"388","cats",46.36,"seemed no bounds so",11
"389","cats",46.36,"the sad scared shelter",11
"390","cats",46.36,"to the sad scared",11
"391","celebs",62.94,"nsfw compilation from /r/nsfwcelebarchive",17
"392","celebs",24,"i don't care what",11
"393","celebs",22.18,"i've always thought she",11
"394","celebs",22,"have no idea who",11
"395","celebs",17.08,"i saw her in",12
"396","celebs",16.73,"no idea who she",11
"397","celebs",16.46,"you can see her",13
"398","celebs",16.28,"i have no idea",25
"399","celebs",16.27,"if you know what",15
"400","celebs",15.75,"the fact that she",12
"401","cfb",89.91,"are a beautiful strong",11
"402","cfb",89.91,"this if you are",11
"403","cfb",89.91,"you are a beautiful",11
"404","cfb",67.27,"edit: thanks for the",11
"405","cfb",56.36,"take a moment to",14
"406","cfb",54.64,"acc acc acc acc",14
"407","cfb",53.75,"one welcome our new",16
"408","cfb",53.44,"for one welcome our",18
"409","cfb",52.62,"right in the pussy",13
"410","cfb",52.55,"the other end of",11
"411","changemyview",60.15,"thanks for the gold",13
"412","changemyview",44.38,"edit: thanks for the",13
"413","changemyview",42.14,"men are seen as",14
"414","changemyview",40.09,"you see on the",11
"415","changemyview",39.91,"will be the one",11
"416","changemyview",38.92,"of the federal reserve",12
"417","changemyview",37.77,"that this argument is",13
"418","changemyview",37.27,"more numerous than men's",11
"419","changemyview",37.27,"numerous than men's issues",11
"420","changemyview",36.64,"is something you should",11
"421","chemicalreactiongifs",36.58,"what the hell is",12
"422","chemicalreactiongifs",34.82,"you end up with",11
"423","chemicalreactiongifs",23.87,"the surface of the",31
"424","chemicalreactiongifs",23.82,"all i could think",11
"425","chemicalreactiongifs",23.79,"want to try this",14
"426","chemicalreactiongifs",22.71,"what happens when you",21
"427","chemicalreactiongifs",21.33,"and put it in",12
"428","chemicalreactiongifs",19.73,"can be used to",11
"429","chemicalreactiongifs",19,"if you were to",12
"430","chemicalreactiongifs",19,"it looks like it's",11
"431","circlejerk",79.18,"1000 upvotes i will",11
"432","circlejerk",66.81,"comment gets 1000 upvotes",21
"433","circlejerk",65.07,"lolas u can see",15
"434","circlejerk",65.07,"lolneways i hope 2",15
"435","circlejerk",65.07,"merrier lolneways i hope",15
"436","circlejerk",65.07,"more the merrier lolneways",15
"437","circlejerk",65.07,"the merrier lolneways i",15
"438","circlejerk",64.29,"and i can't use",14
"439","circlejerk",63.64,"the time i had",11
"440","circlejerk",61.93,"upvote this comment if",15
"441","cityporn",18.18,"this is the first",11
"442","cityporn",18.06,"i have ever seen",16
"443","cityporn",16.73,"in the us and",11
"444","cityporn",16.44,"one of the largest",16
"445","cityporn",15,"supposed to be a",13
"446","cityporn",14.94,"has a population of",17
"447","cityporn",14.82,"thought it would be",11
"448","cityporn",14.77,"what you see in",13
"449","cityporn",14.36,"take a look at",14
"450","cityporn",14.27,"it is a great",11
"451","civ",49.93,"would you be interested",15
"452","civ",48.73,"be interested in a",22
"453","civ",48.54,"you be interested in",24
"454","civ",46.27,"trade agreement with england",15
"455","civ",45.36,"the edge of the",11
"456","civ",44.46,"to capture the city",13
"457","civ",42.17,"interested in a trade",18
"458","civ",40.68,"in a trade agreement",19
"459","civ",40,"you can also get",11
"460","civ",39.54,"and all of the",13
"461","comicbooks",29.74,"the super soldier serum",23
"462","comicbooks",28.77,"to live in a",13
"463","comicbooks",27.5,"you son of a",14
"464","comicbooks",27.15,"you have to admit",13
"465","comicbooks",27.14,"wait to see the",14
"466","comicbooks",26.82,"doesn't seem to be",11
"467","comicbooks",26.71,"they're going to be",17
"468","comicbooks",26.55,"much as the next",11
"469","comicbooks",26.25,"i like it when",12
"470","comicbooks",26.18,"i like how he",11
"471","comics",64,"hey peeps thanks for",12
"472","comics",45.45,"what i thought too",11
"473","comics",38.09,"there is no need",11
"474","comics",37.82,"out of the sky",11
"475","comics",37,"to live in the",13
"476","comics",36.75,"i was on the",12
"477","comics",36.21,"a hole in the",14
"478","comics",35.91,"the punchline in the",11
"479","comics",35.86,"of the best comics",14
"480","comics",35,"but then i realized",11
"481","community",59,"we need a shorthand",12
"482","community",57.08,"need a shorthand for",13
"483","community",53.9,"oh britta's in this",20
"484","community",48.92,"i'll make your ass",12
"485","community",47.45,"to take care of",11
"486","community",47.32,"on the air buddy",19
"487","community",45.36,"and a theme park",14
"488","community",43.18,"with eartha kitt in",11
"489","community",41.92,"mere fact that you",12
"490","community",41.15,"seasons and a theme",13
"491","conspiracy",35.42,"side of the road",19
"492","conspiracy",32.55,"no i am not",11
"493","conspiracy",31.08,"to give a shit",12
"494","conspiracy",31,"to comment on the",12
"495","conspiracy",30.8,"i have to go",15
"496","conspiracy",30.64,"the us supreme court",11
"497","conspiracy",30.08,"to explain this to",13
"498","conspiracy",29.85,"of the front page",13
"499","conspiracy",29.33,"the last few months",12
"500","conspiracy",28.73,"at the scene of",11
"501","cooking",37.88,"with plastic wrap and",16
"502","cooking",35.75,"preheat your oven to",12
"503","cooking",33.88,"cover with plastic wrap",16
"504","cooking",33.07,"cup at a time",15
"505","cooking",32.65,"preheat the oven to",23
"506","cooking",32.15,"in a pot and",13
"507","cooking",32.08,"the cheese is melted",12
"508","cooking",31.41,"in a large bowl",32
"509","cooking",30.2,"minutes or until the",15
"510","cooking",29.45,"if you're going for",11
"511","cosplay",22.08,"had a great time",13
"512","cosplay",17.91,"the one on the",11
"513","cosplay",16.1,"this is the first",21
"514","cosplay",16.08,"with a lot of",12
"515","cosplay",15.91,"got a picture of",11
"516","cosplay",15.45,"on a side note",11
"517","cosplay",15,"to give it a",13
"518","cosplay",14.93,"i thought i was",14
"519","cosplay",14.29,"this is why i",14
"520","cosplay",13.88,"did a good job",25
"521","cosplaygirls",13.82,"this is just a",11
"522","cosplaygirls",12.54,"of girls in costumes""",13
"523","cosplaygirls",11.24,"sexy pictures and videos",25
"524","cosplaygirls",11.24,"share sexy pictures and",25
"525","cosplaygirls",10.88,"pictures and videos of",26
"526","cosplaygirls",10.73,"do you have a",15
"527","cosplaygirls",10.63,"i the only one",30
"528","cosplaygirls",10.39,"and videos of girls",31
"529","cosplaygirls",10.39,"videos of girls in",31
"530","cosplaygirls",10.31,"to share sexy pictures",29
"531","crappydesign",37.12,"not a crappy design",17
"532","crappydesign",36.87,"are a lot of",15
"533","crappydesign",35.55,"i like how the",11
"534","crappydesign",34.69,"there are a lot",13
"535","crappydesign",34.64,"knew exactly what they",11
"536","crappydesign",34.26,"me a while to",27
"537","crappydesign",33.31,"the first time i've",13
"538","crappydesign",33,"from left to right",14
"539","crappydesign",33,"would have been better",13
"540","crappydesign",32.18,"but i'm not sure",17
"541","crazyideas",39.25,"now this is a",20
"542","crazyideas",37,"all the people who",11
"543","crazyideas",36.27,"a whole new meaning",11
"544","crazyideas",36.27,"would be awesome to",11
